number,value,datetime_start,datetime_complete,duration,params_batch_size,params_dropout,params_emb_dim,params_h1,params_h2,params_lr_adam,params_lr_sgd,params_optimizer,params_weight_decay,user_attrs_best_epoch,state
0,0.729130418956794,2026-09-26 09:57:33.413045,2026-09-26 09:57:47.775086,0 days 00:00:14.362041,32,0.6000000000000001,32,16,8,,0.24376795198947104,sgd,0.016598654663071283,1.0,COMPLETE
1,0.7682112134337955,2026-09-26 09:57:34.756080,2026-09-26 09:58:17.525507,0 days 00:00:42.769427,64,0.1,32,128,8,,0.010006061777325435,sgd,1.5438636235829025e-06,,PRUNED
2,0.7942319125444375,2026-09-26 09:57:34.774110,2026-09-26 09:58:16.046151,0 days 00:00:41.272041,32,0.6000000000000001,32,64,64,0.002299220414604692,,adam,3.005196414798279e-07,12.0,COMPLETE
3,0.7934772321916062,2026-09-26 09:57:34.831910,2026-09-26 09:58:11.943210,0 days 00:00:37.111300,64,0.2,8,256,16,,0.04670684478411478,sgd,3.0946189602226306e-05,37.0,COMPLETE
4,0.5,2026-09-26 09:57:34.923942,2026-09-26 09:57:47.292803,0 days 00:00:12.368861,64,0.0,16,256,8,0.025671846197924494,,adam,0.05494368786801348,1.0,COMPLETE
5,0.7866147368931922,2026-09-26 09:57:34.941413,2026-09-26 09:58:17.659802,0 days 00:00:42.718389,32,0.5,2,128,16,,0.02989971007098552,sgd,0.0003013192384535341,,PRUNED
6,0.7872001601572453,2026-09-26 09:57:34.998138,2026-09-26 09:57:53.147734,0 days 00:00:18.149596,128,0.7,8,128,32,0.010821416575300875,,adam,0.008761058806134524,18.0,COMPLETE
7,0.7941445540470037,2026-09-26 09:57:35.055672,2026-09-26 09:58:16.919011,0 days 00:00:41.863339,64,0.7,4,128,32,,0.10204524951330768,sgd,1.4105723459024794e-07,58.0,COMPLETE
8,0.7903747922202404,2026-09-26 09:57:35.115720,2026-09-26 09:58:07.691501,0 days 00:00:32.575781,64,0.2,2,256,128,,1.0000983461717243,sgd,2.054974158348158e-06,25.0,COMPLETE
9,0.7934717722855167,2026-09-26 09:57:47.294364,2026-09-26 09:58:02.358622,0 days 00:00:15.064258,128,0.6000000000000001,32,128,32,0.0030768942042134623,,adam,1.185341419462865e-06,17.0,COMPLETE
10,0.7805530278212549,2026-09-26 09:57:47.776422,2026-09-26 09:58:17.563307,0 days 00:00:29.786885,64,0.5,2,128,16,,0.021372740576773155,sgd,2.2980148444982732e-07,,PRUNED
11,0.6832708477414189,2026-09-26 09:57:53.149103,2026-09-26 09:58:09.635254,0 days 00:00:16.486151,128,0.30000000000000004,32,256,64,0.0002038002045021977,,adam,0.0863533299948515,14.0,COMPLETE
12,0.7562424926291268,2026-09-26 09:58:02.360376,2026-09-26 09:58:08.027053,0 days 00:00:05.666677,256,0.4,4,16,128,,1.1496748852084764,sgd,3.2208438192928783e-07,16.0,COMPLETE
13,0.6843051966172848,2026-09-26 09:58:07.693166,2026-09-26 09:58:17.100632,0 days 00:00:09.407466,128,0.6000000000000001,8,64,16,,0.08049441466061164,sgd,1.5561409757619444e-07,,PRUNED
14,0.6254128295659981,2026-09-26 09:58:08.028692,2026-09-26 09:58:17.446011,0 days 00:00:09.417319,64,0.5,32,64,128,,0.014116368538734483,sgd,7.804786664842554e-07,,PRUNED
15,0.7991870806488796,2026-09-26 09:58:09.636683,2026-09-26 09:58:49.014306,0 days 00:00:39.377623,32,0.30000000000000004,32,256,8,,0.5750623731508197,sgd,0.0028268458406199995,22.0,COMPLETE
16,0.660208204418884,2026-09-26 09:58:11.946031,2026-09-26 09:58:17.082697,0 days 00:00:05.136666,64,0.2,16,16,8,,0.05069343003337681,sgd,5.63321912876489e-06,,PRUNED
17,0.5581067472306143,2026-09-26 09:58:16.048295,2026-09-26 09:58:18.146176,0 days 00:00:02.097881,256,0.7,16,256,64,,0.03311771716101692,sgd,1.1211969715597738e-05,,PRUNED
18,0.7912471638821146,2026-09-26 09:58:16.921235,2026-09-26 09:58:58.180681,0 days 00:00:41.259446,32,0.5,32,64,64,0.0010132539500326966,,adam,3.762183794944018e-07,16.0,COMPLETE
19,0.6892737111588347,2026-09-26 09:58:17.084160,2026-09-26 09:58:20.110804,0 days 00:00:03.026644,64,0.6000000000000001,4,128,32,,0.16521173210152942,sgd,0.0001047321156107007,,PRUNED
20,0.7634574551984373,2026-09-26 09:58:17.102048,2026-09-26 09:58:23.840184,0 days 00:00:06.738136,64,0.5,4,128,32,,0.2240686024745759,sgd,3.017988704976316e-05,,PRUNED
21,0.794588019752727,2026-09-26 09:58:17.447693,2026-09-26 09:59:02.694192,0 days 00:00:45.246499,32,0.6000000000000001,4,128,64,,0.15294513127203446,sgd,1.5300368222692838e-07,34.0,COMPLETE
22,0.6795690314126597,2026-09-26 09:58:17.527114,2026-09-26 09:58:20.324679,0 days 00:00:02.797565,64,0.6000000000000001,16,16,32,,0.5156143449751126,sgd,1.364067159371044e-07,,PRUNED
23,0.7926994989019523,2026-09-26 09:58:17.565071,2026-09-26 09:58:44.089535,0 days 00:00:26.524464,64,0.7,4,256,32,0.001055535211394178,,adam,6.775732886431175e-07,19.0,COMPLETE
24,0.5007552870090635,2026-09-26 09:58:17.661312,2026-09-26 09:58:20.351689,0 days 00:00:02.690377,64,0.7,4,64,8,,1.8685780890246015,sgd,3.6473625434087592e-06,,PRUNED
25,0.6284242711025371,2026-09-26 09:58:18.147414,2026-09-26 09:58:21.444292,0 days 00:00:03.296878,64,0.7,8,128,32,,0.09149922614447964,sgd,1.0404398532503652e-07,,PRUNED
26,0.6174140671447117,2026-09-26 09:58:20.111959,2026-09-26 09:58:30.308827,0 days 00:00:10.196868,32,0.6000000000000001,16,64,32,0.0001046184162600569,,adam,2.607802747778744e-07,,PRUNED
27,0.6333751926133537,2026-09-26 09:58:20.325760,2026-09-26 09:58:21.639109,0 days 00:00:01.313349,256,0.6000000000000001,32,32,32,,0.3269423120411447,sgd,1.502419923467651e-07,,PRUNED
28,0.724195877164246,2026-09-26 09:58:20.352797,2026-09-26 09:58:29.141946,0 days 00:00:08.789149,32,0.5,32,256,16,,0.08888804738052179,sgd,1.8264708151233755e-07,,PRUNED
29,0.6452480617333383,2026-09-26 09:58:21.445721,2026-09-26 09:58:23.552434,0 days 00:00:02.106713,256,0.1,8,256,16,,0.04876415696210568,sgd,0.0005856096671705891,,PRUNED
30,0.7650857205256071,2026-09-26 09:58:21.641290,2026-09-26 09:58:30.441512,0 days 00:00:08.800222,64,0.2,4,256,16,,0.05942694517414676,sgd,1.635359342031204e-05,,PRUNED
31,0.7053792208107355,2026-09-26 09:58:23.553649,2026-09-26 09:58:30.357748,0 days 00:00:06.804099,32,0.2,8,64,16,,0.034187782417269205,sgd,1.2572004382672733e-05,,PRUNED
32,0.7743724141278103,2026-09-26 09:58:23.842243,2026-09-26 09:58:31.942243,0 days 00:00:08.100000,64,0.0,8,256,32,,0.152767232971023,sgd,3.6695609977434856e-07,,PRUNED
33,0.6965238597896116,2026-09-26 09:58:29.143498,2026-09-26 09:58:31.729398,0 days 00:00:02.585900,64,0.2,8,32,16,,0.07919142406126778,sgd,2.2194969391483455e-05,,PRUNED
34,0.6195998495492544,2026-09-26 09:58:30.310715,2026-09-26 09:58:32.453968,0 days 00:00:02.143253,128,0.30000000000000004,8,256,8,,0.015663778402755058,sgd,9.642635438818574e-05,,PRUNED
35,0.7922408667904245,2026-09-26 09:58:30.359558,2026-09-26 09:58:57.234001,0 days 00:00:26.874443,32,0.7,32,32,16,0.003402071899951855,,adam,3.04291356724644e-06,10.0,COMPLETE
36,0.6785134495686674,2026-09-26 09:58:30.442959,2026-09-26 09:58:32.006804,0 days 00:00:01.563845,256,0.5,4,128,32,0.0005927514815383725,,adam,2.4997277981147835e-07,,PRUNED
37,0.6549812543224256,2026-09-26 09:58:31.730835,2026-09-26 09:58:35.614364,0 days 00:00:03.883529,64,0.6000000000000001,4,128,32,,0.10835485255283242,sgd,2.6143847659153204e-07,,PRUNED
38,0.7958953639330737,2026-09-26 09:58:31.943954,2026-09-26 09:58:52.817179,0 days 00:00:20.873225,32,0.5,8,16,64,0.004119193383429978,,adam,5.020534395131258e-07,7.0,COMPLETE
39,0.7944551620378796,2026-09-26 09:58:32.008038,2026-09-26 09:58:45.039449,0 days 00:00:13.031411,128,0.6000000000000001,32,128,32,0.0028575255477920037,,adam,2.6512232905147505e-06,17.0,COMPLETE
40,0.7947475703417901,2026-09-26 09:58:32.455495,2026-09-26 09:58:38.238515,0 days 00:00:05.783020,256,0.7,32,64,16,0.006002225475859842,,adam,1.807624183106226e-06,9.0,COMPLETE
41,0.7898069619869205,2026-09-26 09:58:35.616035,2026-09-26 09:58:53.931655,0 days 00:00:18.315620,32,0.7,32,256,64,0.001268599313524898,,adam,1.7628236241115377e-07,,PRUNED
42,0.7903116999720938,2026-09-26 09:58:38.239572,2026-09-26 09:58:42.357750,0 days 00:00:04.118178,256,0.7,32,64,16,0.010086648722715861,,adam,4.1768080823115094e-07,9.0,COMPLETE
43,0.795879590871037,2026-09-26 09:58:42.359171,2026-09-26 09:58:53.117173,0 days 00:00:10.758002,64,0.5,32,16,16,0.008486840933216727,,adam,1.502809270274562e-06,6.0,COMPLETE
44,0.6277982018709278,2026-09-26 09:58:44.091057,2026-09-26 09:58:44.988724,0 days 00:00:00.897667,256,0.6000000000000001,32,64,16,,0.3342403467278912,sgd,0.0009684804932297641,,PRUNED
45,0.8002281027432995,2026-09-26 09:58:44.989877,2026-09-26 09:58:53.823167,0 days 00:00:08.833290,256,0.7,32,256,32,0.002582944370011072,,adam,2.9913267970371763e-05,13.0,COMPLETE
46,0.7991082153386962,2026-09-26 09:58:45.040945,2026-09-26 09:58:53.016477,0 days 00:00:07.975532,128,0.7,32,64,8,0.004427621049197318,,adam,1.0797572177423905e-05,9.0,COMPLETE
47,0.7765102706900109,2026-09-26 09:58:49.015686,2026-09-26 09:58:53.847160,0 days 00:00:04.831474,32,0.4,4,256,8,,0.7290170695980305,sgd,0.0055487312347181055,,PRUNED
48,0.7848524005387107,2026-09-26 09:58:52.818457,2026-09-26 09:58:57.255250,0 days 00:00:04.436793,64,0.2,32,256,8,,1.8591606491840749,sgd,0.0006275396735015359,,PRUNED
49,0.7939728703332969,2026-09-26 09:58:53.018284,2026-09-26 09:59:11.933717,0 days 00:00:18.915433,32,0.5,8,16,64,0.0048288802140731045,,adam,6.454894608156455e-07,5.0,COMPLETE
50,0.796383115543746,2026-09-26 09:58:53.118360,2026-09-26 09:59:04.887215,0 days 00:00:11.768855,64,0.5,32,16,16,0.009345877866788482,,adam,7.239687327623212e-06,6.0,COMPLETE
51,0.796460767541465,2026-09-26 09:58:53.824528,2026-09-26 09:59:01.497727,0 days 00:00:07.673199,128,0.6000000000000001,32,64,8,0.005240082814200709,,adam,0.00010340518793037356,9.0,COMPLETE
52,0.7898263749863503,2026-09-26 09:58:53.848885,2026-09-26 09:58:57.544975,0 days 00:00:03.696090,128,0.7,32,32,8,0.00488930964070333,,adam,4.57623396149531e-05,,PRUNED
53,0.7706754510489086,2026-09-26 09:58:53.933211,2026-09-26 09:58:55.861452,0 days 00:00:01.928241,256,0.7,8,256,32,0.0033340720922165677,,adam,0.00029179868239918893,,PRUNED
54,0.7956429949404871,2026-09-26 09:58:55.862631,2026-09-26 09:59:02.490103,0 days 00:00:06.627472,256,0.6000000000000001,32,256,32,0.014428234664503629,,adam,2.130814167348308e-05,7.0,COMPLETE
55,0.774729127992332,2026-09-26 09:58:57.235220,2026-09-26 09:59:04.249995,0 days 00:00:07.014775,32,0.30000000000000004,32,256,32,,0.4441721930182568,sgd,0.0010965995901378442,,PRUNED
56,0.7530545141290237,2026-09-26 09:58:57.256558,2026-09-26 09:58:59.412581,0 days 00:00:02.156023,128,0.7,8,64,64,0.0027068487094139117,,adam,3.851151705915169e-06,,PRUNED
57,0.7951152040184909,2026-09-26 09:58:57.546284,2026-09-26 09:59:20.387751,0 days 00:00:22.841467,32,0.4,2,256,128,0.008961089758099835,,adam,1.3491847438692972e-07,5.0,COMPLETE
58,0.7783120396995838,2026-09-26 09:58:58.182034,2026-09-26 09:59:00.501292,0 days 00:00:02.319258,256,0.30000000000000004,32,256,128,,0.5122054349431884,sgd,0.013600449302919891,,PRUNED
59,0.7704546281803953,2026-09-26 09:58:59.413900,2026-09-26 09:59:00.767649,0 days 00:00:01.353749,256,0.7,4,16,16,0.005399478744014825,,adam,9.175571806718161e-05,,PRUNED
60,0.5,2026-09-26 09:59:00.503240,2026-09-26 09:59:07.706118,0 days 00:00:07.202878,32,0.2,32,256,8,,1.8587552957194236,sgd,0.02405627035349582,,PRUNED
61,0.7400332447615234,2026-09-26 09:59:00.769313,2026-09-26 09:59:07.568875,0 days 00:00:06.799562,32,0.30000000000000004,32,128,8,,0.5917663970724353,sgd,6.0974836668166e-05,,PRUNED
62,0.6425721010931945,2026-09-26 09:59:01.498754,2026-09-26 09:59:03.654592,0 days 00:00:02.155838,128,0.7,32,64,8,,0.8114791285127326,sgd,1.392028765449545e-05,,PRUNED
63,0.7970140380252125,2026-09-26 09:59:02.491509,2026-09-26 09:59:11.185146,0 days 00:00:08.693637,128,0.6000000000000001,32,64,8,0.004718568781824084,,adam,5.9807228851703984e-05,9.0,COMPLETE
64,0.7891366068503621,2026-09-26 09:59:02.696285,2026-09-26 09:59:06.660796,0 days 00:00:03.964511,128,0.5,16,16,16,0.004695027416506448,,adam,1.7422394270456021e-06,,PRUNED
65,0.8057741540178842,2026-09-26 09:59:03.655827,2026-09-26 09:59:16.008887,0 days 00:00:12.353060,128,0.5,32,256,128,0.0051842988873655495,,adam,0.001529184352910447,9.0,COMPLETE
66,0.7978415171259055,2026-09-26 09:59:04.279393,2026-09-26 09:59:16.108847,0 days 00:00:11.829454,64,0.4,32,128,8,0.0022367968723745074,,adam,0.0003071246767825789,6.0,COMPLETE
67,0.7994697824530752,2026-09-26 09:59:04.890125,2026-09-26 09:59:35.984034,0 days 00:00:31.093909,32,0.6000000000000001,8,64,8,0.0025061309014622873,,adam,1.3972981134865754e-05,15.0,COMPLETE
68,0.7337895388199323,2026-09-26 09:59:06.662514,2026-09-26 09:59:12.408329,0 days 00:00:05.745815,32,0.6000000000000001,32,256,8,,0.29351706327445876,sgd,0.0002864230541390159,,PRUNED
69,0.796085853989978,2026-09-26 09:59:07.570241,2026-09-26 09:59:16.136398,0 days 00:00:08.566157,64,0.4,32,16,16,0.011574913007636037,,adam,1.0603958612751829e-05,4.0,COMPLETE
70,0.7961726058311798,2026-09-26 09:59:07.707938,2026-09-26 09:59:17.157190,0 days 00:00:09.449252,64,0.4,32,32,64,0.008986196749672307,,adam,8.559583551596603e-07,5.0,COMPLETE
71,0.7718171780778704,2026-09-26 09:59:11.187121,2026-09-26 09:59:12.774635,0 days 00:00:01.587514,128,0.6000000000000001,4,64,8,0.0038633556229688113,,adam,5.8768966049782735e-06,,PRUNED
72,0.7985306786056613,2026-09-26 09:59:11.935237,2026-09-26 09:59:16.510090,0 days 00:00:04.574853,128,0.4,32,64,8,0.004758638055942851,,adam,9.712717878544933e-05,4.0,COMPLETE
73,0.7764835778157949,2026-09-26 09:59:12.409688,2026-09-26 09:59:14.242906,0 days 00:00:01.833218,128,0.7,16,64,8,0.002929655991203031,,adam,0.00013101253964033585,,PRUNED
74,0.5133707033572356,2026-09-26 09:59:12.775754,2026-09-26 09:59:14.878437,0 days 00:00:02.102683,128,0.7,32,64,8,0.023855095787872194,,adam,1.6308619545886853e-06,,PRUNED
75,0.6174838326114125,2026-09-26 09:59:14.244322,2026-09-26 09:59:18.149784,0 days 00:00:03.905462,32,0.2,8,32,8,,0.010057198725926095,sgd,0.04354496758360295,,PRUNED
76,0.795575049442483,2026-09-26 09:59:14.879629,2026-09-26 09:59:30.187950,0 days 00:00:15.308321,32,0.6000000000000001,32,16,32,0.006535246969140366,,adam,0.00014291371082964885,,PRUNED
77,0.803066040597435,2026-09-26 09:59:16.010148,2026-09-26 09:59:24.811089,0 days 00:00:08.800941,128,0.6000000000000001,2,256,128,0.008162427216363587,,adam,0.0003834031304370564,6.0,COMPLETE
78,0.7889103240757591,2026-09-26 09:59:16.114415,2026-09-26 09:59:20.141074,0 days 00:00:04.026659,64,0.4,2,128,8,0.0015442766872175997,,adam,0.00040431734511885815,,PRUNED
79,0.7474235309819337,2026-09-26 09:59:16.138060,2026-09-26 09:59:18.260121,0 days 00:00:02.122061,128,0.7,32,16,128,0.001837364508228074,,adam,0.0004140458744616957,,PRUNED
80,0.7959414698067193,2026-09-26 09:59:16.511367,2026-09-26 09:59:25.623123,0 days 00:00:09.111756,128,0.4,32,256,8,0.002358624857899764,,adam,0.00014248398599049614,7.0,COMPLETE
81,0.7622150232349336,2026-09-26 09:59:17.158607,2026-09-26 09:59:19.525551,0 days 00:00:02.366944,128,0.7,32,64,8,0.0027742475937077185,,adam,0.0013549114528155807,,PRUNED
82,0.7926491464346813,2026-09-26 09:59:18.151205,2026-09-26 09:59:25.568210,0 days 00:00:07.417005,64,0.5,32,128,8,0.0034867109656226323,,adam,4.025871491295214e-06,,PRUNED
83,0.8029968817869665,2026-09-26 09:59:18.261562,2026-09-26 09:59:24.721866,0 days 00:00:06.460304,128,0.4,32,64,32,0.003230231222587517,,adam,0.00016961579292348002,5.0,COMPLETE
84,0.7808296630631286,2026-09-26 09:59:19.527057,2026-09-26 09:59:24.140694,0 days 00:00:04.613637,64,0.1,32,128,8,0.0015681500005903476,,adam,0.0061984815765856556,,PRUNED
85,0.8035416590834638,2026-09-26 09:59:20.142237,2026-09-26 09:59:31.528149,0 days 00:00:11.385912,64,0.30000000000000004,32,64,8,0.004292466228286104,,adam,0.0004131427111763645,5.0,COMPLETE
86,0.8020480714398379,2026-09-26 09:59:20.389154,2026-09-26 09:59:27.649986,0 days 00:00:07.260832,128,0.30000000000000004,16,64,16,0.004145656218781215,,adam,0.00029655722143309373,8.0,COMPLETE
87,0.767911525255099,2026-09-26 09:59:24.141818,2026-09-26 09:59:28.296040,0 days 00:00:04.154222,128,0.5,32,256,128,0.0013403454810580234,,adam,0.004705847546611798,,PRUNED
88,0.7879566604787731,2026-09-26 09:59:24.723126,2026-09-26 09:59:28.303815,0 days 00:00:03.580689,128,0.7,2,256,128,0.004910414132952606,,adam,2.3737978380610133e-05,,PRUNED
89,0.8011587134034628,2026-09-26 09:59:24.812959,2026-09-26 09:59:38.191389,0 days 00:00:13.378430,128,0.6000000000000001,2,256,128,0.002917220695859726,,adam,0.0006787007910357343,12.0,COMPLETE
90,0.8021390698746648,2026-09-26 09:59:25.569599,2026-09-26 09:59:31.999438,0 days 00:00:06.429839,128,0.30000000000000004,8,64,32,0.006768092586032249,,adam,8.964320245532554e-05,7.0,COMPLETE
91,0.7079374901418363,2026-09-26 09:59:25.624924,2026-09-26 09:59:28.222123,0 days 00:00:02.597199,128,0.5,32,64,32,0.0005948966073342385,,adam,2.516973494657061e-05,,PRUNED
92,0.7894308351229693,2026-09-26 09:59:27.651690,2026-09-26 09:59:30.072976,0 days 00:00:02.421286,128,0.30000000000000004,2,64,16,0.0027474747465377628,,adam,0.001359013901359162,,PRUNED
93,0.8069813999199213,2026-09-26 09:59:28.223563,2026-09-26 09:59:46.543116,0 days 00:00:18.319553,64,0.4,32,128,128,0.005472075340482052,,adam,0.0031137629439129755,17.0,COMPLETE
94,0.7625596039748117,2026-09-26 09:59:28.297344,2026-09-26 09:59:30.954954,0 days 00:00:02.657610,128,0.4,32,64,32,0.0016734669975107589,,adam,0.004932759810589498,,PRUNED
95,0.735516082456715,2026-09-26 09:59:28.305461,2026-09-26 09:59:31.017879,0 days 00:00:02.712418,128,0.30000000000000004,32,64,32,0.0016199067297664902,,adam,0.013244441039935401,,PRUNED
96,0.7980320071828096,2026-09-26 09:59:30.074158,2026-09-26 09:59:34.962423,0 days 00:00:04.888265,128,0.1,16,64,16,0.00754971190579175,,adam,5.6547264293712145e-05,4.0,COMPLETE
97,0.5785595554423131,2026-09-26 09:59:30.189582,2026-09-26 09:59:32.056724,0 days 00:00:01.867142,128,0.30000000000000004,16,32,16,0.00010724101667267486,,adam,0.000903263364080609,,PRUNED
98,0.8037163760783315,2026-09-26 09:59:30.956624,2026-09-26 09:59:39.433965,0 days 00:00:08.477341,128,0.30000000000000004,16,64,64,0.004918251372481015,,adam,0.0007243601991950414,11.0,COMPLETE
99,0.8028003251677405,2026-09-26 09:59:31.019251,2026-09-26 09:59:35.556432,0 days 00:00:04.537181,256,0.30000000000000004,32,128,32,0.005882578571149398,,adam,0.00019806860076569273,6.0,COMPLETE
100,0.8007813732270471,2026-09-26 09:59:31.530021,2026-09-26 09:59:41.175835,0 days 00:00:09.645814,64,0.5,32,64,64,0.003989928995091842,,adam,0.0001514028278195054,4.0,COMPLETE
101,0.8001880634319756,2026-09-26 09:59:32.000869,2026-09-26 09:59:37.563074,0 days 00:00:05.562205,128,0.1,8,64,32,0.012035029545426948,,adam,2.099689605582117e-05,5.0,COMPLETE
102,0.8062291461920189,2026-09-26 09:59:32.057931,2026-09-26 09:59:46.424156,0 days 00:00:14.366225,64,0.30000000000000004,16,64,16,0.007187343801991583,,adam,0.0011118993880848533,19.0,COMPLETE
103,0.7857726980429269,2026-09-26 09:59:34.963916,2026-09-26 09:59:38.700053,0 days 00:00:03.736137,64,0.30000000000000004,4,64,8,0.007888662018301582,,adam,0.012620262620057218,,PRUNED
104,0.8039687450709181,2026-09-26 09:59:35.557708,2026-09-26 09:59:44.347878,0 days 00:00:08.790170,64,0.2,2,64,128,0.008066647783275503,,adam,0.0006270216933075065,7.0,COMPLETE
105,0.787926327667164,2026-09-26 09:59:35.985812,2026-09-26 09:59:37.995180,0 days 00:00:02.009368,256,0.2,32,128,32,0.004066567123919194,,adam,0.00011201964928161179,,PRUNED
106,0.7930501462041519,2026-09-26 09:59:37.564620,2026-09-26 09:59:42.778483,0 days 00:00:05.213863,32,0.5,8,64,8,0.013960679126874683,,adam,2.5091171613287472e-05,,PRUNED
107,0.799929021220835,2026-09-26 09:59:37.996517,2026-09-26 09:59:41.586733,0 days 00:00:03.590216,128,0.1,8,64,32,0.013116172152091292,,adam,1.6123571463189213e-05,3.0,COMPLETE
