number,value,datetime_start,datetime_complete,duration,params_batch_size,params_lr_adam,params_lr_sgd,params_optimizer,params_weight_decay,user_attrs_best_epoch,state
0,0.7769858891760395,2026-09-27 09:02:11.061387,2026-09-27 09:02:14.028308,0 days 00:00:02.966921,256,,0.24376795198947104,sgd,0.00018590843630169612,57.0,COMPLETE
1,0.7016804377631372,2026-09-27 09:02:11.286184,2026-09-27 09:02:14.057223,0 days 00:00:02.771039,256,,0.010006061777325435,sgd,6.516215458215685e-06,60.0,COMPLETE
2,0.7642740144869509,2026-09-27 09:02:11.300150,2026-09-27 09:02:14.337102,0 days 00:00:03.036952,256,0.002299220414604692,,adam,4.091988040159679e-05,60.0,COMPLETE
3,0.7766279619990536,2026-09-27 09:02:11.303886,2026-09-27 09:02:17.744286,0 days 00:00:06.440400,64,,0.04670684478411478,sgd,0.00011613567037801697,57.0,COMPLETE
4,0.7741218651039202,2026-09-27 09:02:11.437201,2026-09-27 09:02:14.155583,0 days 00:00:02.718382,128,0.025671846197924494,,adam,0.0019448941142879627,21.0,COMPLETE
5,0.7383637268105656,2026-09-27 09:02:11.483194,2026-09-27 09:02:14.346500,0 days 00:00:02.863306,128,,0.02989971007098552,sgd,0.032483696759414885,32.0,COMPLETE
6,0.7770659677986873,2026-09-27 09:02:11.525443,2026-09-27 09:02:15.503654,0 days 00:00:03.978211,64,0.010821416575300875,,adam,1.7790155916779274e-07,22.0,COMPLETE
7,0.7733556582826775,2026-09-27 09:02:11.702177,2026-09-27 09:02:19.325282,0 days 00:00:07.623105,32,,0.10204524951330768,sgd,0.0021917502612130643,31.0,COMPLETE
8,0.7769713294264673,2026-09-27 09:02:11.734961,2026-09-27 09:02:13.390676,0 days 00:00:01.655715,128,,1.0000983461717243,sgd,0.0001531560472730162,6.0,COMPLETE
9,0.7769628362392167,2026-09-27 09:02:13.391462,2026-09-27 09:02:28.248407,0 days 00:00:14.856945,32,0.002375118734191166,,adam,0.00018210258268461937,56.0,COMPLETE
10,0.7770611145488296,2026-09-27 09:02:14.029276,2026-09-27 09:02:17.159429,0 days 00:00:03.130153,64,0.009145320282946534,,adam,0.00014906288366101656,22.0,COMPLETE
11,0.7749329644863442,2026-09-27 09:02:14.058098,2026-09-27 09:02:17.952893,0 days 00:00:03.894795,64,,0.09216778523802117,sgd,0.0012921621108432525,34.0,COMPLETE
12,0.7773025637292371,2026-09-27 09:02:14.156767,2026-09-27 09:02:15.178108,0 days 00:00:01.021341,64,,0.6214175024534064,sgd,1.5350073085492646e-06,6.0,COMPLETE
13,0.7723279826253655,2026-09-27 09:02:14.338132,2026-09-27 09:02:16.283162,0 days 00:00:01.945030,256,0.0034563985890507572,,adam,0.00014957278000601965,60.0,COMPLETE
14,0.663345223795484,2026-09-27 09:02:14.347715,2026-09-27 09:02:17.164352,0 days 00:00:02.816637,128,0.000158491477118842,,adam,0.002695515150578421,,PRUNED
15,0.7341377594972034,2026-09-27 09:02:15.179160,2026-09-27 09:02:17.221816,0 days 00:00:02.042656,64,,0.012636116402110088,sgd,0.05494368786801348,,PRUNED
16,0.768486635363205,2026-09-27 09:02:15.504775,2026-09-27 09:02:17.311429,0 days 00:00:01.806654,256,,0.10190055838521572,sgd,0.0026019122037845973,58.0,COMPLETE
17,0.7771945789199092,2026-09-27 09:02:16.284954,2026-09-27 09:02:22.275027,0 days 00:00:05.990073,32,0.01250361085391206,,adam,3.005196414798279e-07,10.0,COMPLETE
18,0.6480981327121174,2026-09-27 09:02:17.160424,2026-09-27 09:02:18.058194,0 days 00:00:00.897770,64,0.0006151379144293254,,adam,1.5889965759066688e-07,,PRUNED
19,0.7772795107924143,2026-09-27 09:02:17.167108,2026-09-27 09:02:18.244038,0 days 00:00:01.076930,64,,1.8057749947199098,sgd,6.175019666933861e-07,1.0,COMPLETE
20,0.77718365910773,2026-09-27 09:02:17.222603,2026-09-27 09:02:19.138524,0 days 00:00:01.915921,128,,0.5182046960300926,sgd,2.615899695652862e-07,21.0,COMPLETE
21,0.7769761826763247,2026-09-27 09:02:17.312440,2026-09-27 09:02:19.330471,0 days 00:00:02.018031,128,0.026237291488151928,,adam,1.7243215575739028e-07,15.0,COMPLETE
22,0.6507916863829941,2026-09-27 09:02:17.746388,2026-09-27 09:02:18.379661,0 days 00:00:00.633273,64,0.0006869023997359365,,adam,5.928370099341987e-06,,PRUNED
23,0.6721374925684611,2026-09-27 09:02:17.953987,2026-09-27 09:02:18.164736,0 days 00:00:00.210749,256,0.005836819559884291,,adam,5.631107585583918e-07,,PRUNED
24,0.6195331173637146,2026-09-27 09:02:18.059031,2026-09-27 09:02:18.249055,0 days 00:00:00.190024,256,0.001145956507717036,,adam,0.05645783286255947,,PRUNED
25,0.7770046955192371,2026-09-27 09:02:18.165798,2026-09-27 09:02:20.227547,0 days 00:00:02.061749,64,,0.41620920346556306,sgd,1.3380691320116611e-05,10.0,COMPLETE
26,0.7775767723461824,2026-09-27 09:02:18.244788,2026-09-27 09:02:19.300445,0 days 00:00:01.055657,64,,1.8988806660083086,sgd,1.7295410863534647e-07,1.0,COMPLETE
27,0.7774906271612129,2026-09-27 09:02:18.249900,2026-09-27 09:02:20.381083,0 days 00:00:02.131183,32,,1.5170304868032916,sgd,1.1961536864755732e-06,1.0,COMPLETE
28,0.7777065967798688,2026-09-27 09:02:18.380466,2026-09-27 09:02:19.480958,0 days 00:00:01.100492,64,,1.9851649451165225,sgd,2.00334670266595e-06,1.0,COMPLETE
29,0.7530065882866817,2026-09-27 09:02:19.139373,2026-09-27 09:02:19.458450,0 days 00:00:00.319077,256,,0.44526236406053965,sgd,2.74312506291018e-07,,PRUNED
30,0.777217631856732,2026-09-27 09:02:19.301258,2026-09-27 09:02:20.535800,0 days 00:00:01.234542,64,,1.783588018634595,sgd,3.8934770470751626e-07,1.0,COMPLETE
31,0.7776277314696853,2026-09-27 09:02:19.327333,2026-09-27 09:02:20.791094,0 days 00:00:01.463761,64,,1.9325129700672585,sgd,1.1797120042662077e-07,1.0,COMPLETE
32,0.7777029568424756,2026-09-27 09:02:19.336379,2026-09-27 09:02:20.706041,0 days 00:00:01.369662,64,,1.985019358131911,sgd,1.718852170627594e-07,1.0,COMPLETE
33,0.7773268299785243,2026-09-27 09:02:19.461077,2026-09-27 09:02:22.006120,0 days 00:00:02.545043,64,,0.6306849820389864,sgd,9.337208938451608e-06,6.0,COMPLETE
34,0.7773571627901332,2026-09-27 09:02:19.482439,2026-09-27 09:02:22.007795,0 days 00:00:02.525356,64,,0.6445588074349159,sgd,8.19107446329972e-06,6.0,COMPLETE
35,0.7771302733592982,2026-09-27 09:02:20.233793,2026-09-27 09:02:22.801795,0 days 00:00:02.568002,128,,0.7268443982275099,sgd,5.550982927311841e-06,21.0,COMPLETE
36,0.7773353231657749,2026-09-27 09:02:20.405042,2026-09-27 09:02:23.036909,0 days 00:00:02.631867,32,,1.6491443778007493,sgd,6.614454532371111e-06,1.0,COMPLETE
37,0.7771593928584428,2026-09-27 09:02:20.541078,2026-09-27 09:02:23.106614,0 days 00:00:02.565536,32,,1.9562973108668857,sgd,5.147599058839192e-07,1.0,COMPLETE
38,0.7773001371043085,2026-09-27 09:02:20.719757,2026-09-27 09:02:22.423473,0 days 00:00:01.703716,64,,1.8086871128418105,sgd,1.497650815216151e-07,1.0,COMPLETE
39,0.7774457346000316,2026-09-27 09:02:20.792611,2026-09-27 09:02:22.490831,0 days 00:00:01.698220,64,,1.8552293848146482,sgd,2.767087875842877e-07,1.0,COMPLETE
40,0.7775828389085041,2026-09-27 09:02:22.007364,2026-09-27 09:02:22.628442,0 days 00:00:00.621078,256,,1.9652640989391514,sgd,1.2389502356691841e-05,4.0,COMPLETE
41,0.7774311748504591,2026-09-27 09:02:22.009044,2026-09-27 09:02:23.004227,0 days 00:00:00.995183,64,,1.851461128088783,sgd,1.0160508831857648e-07,1.0,COMPLETE
42,0.777680510561885,2026-09-27 09:02:22.276225,2026-09-27 09:02:23.215542,0 days 00:00:00.939317,64,,1.9739358752885192,sgd,1.1639301977317586e-07,1.0,COMPLETE
43,0.5393095038765333,2026-09-27 09:02:22.424766,2026-09-27 09:02:22.871633,0 days 00:00:00.446867,128,0.00011316195641762245,,adam,1.3692064157894365e-05,,PRUNED
44,0.7777053834674043,2026-09-27 09:02:22.492254,2026-09-27 09:02:23.284297,0 days 00:00:00.792043,64,,1.9584959927806807,sgd,1.0787939390861554e-07,1.0,COMPLETE
45,0.7773765757895632,2026-09-27 09:02:22.629521,2026-09-27 09:02:22.998733,0 days 00:00:00.369212,256,,1.873143388256922,sgd,6.712827842368172e-05,4.0,COMPLETE
46,0.7698443320108228,2026-09-27 09:02:22.803102,2026-09-27 09:02:22.979608,0 days 00:00:00.176506,256,,0.8559522931133148,sgd,1.745997493658286e-05,,PRUNED
47,0.7710491512879312,2026-09-27 09:02:22.872537,2026-09-27 09:02:23.043956,0 days 00:00:00.171419,256,,0.9217383904902345,sgd,1.3911548731525551e-05,,PRUNED
48,0.7776143850325774,2026-09-27 09:02:22.980654,2026-09-27 09:02:23.307303,0 days 00:00:00.326649,256,,1.9903232323359945,sgd,1.5690784593302736e-06,4.0,COMPLETE
49,0.7775713124400928,2026-09-27 09:02:23.000369,2026-09-27 09:02:23.334987,0 days 00:00:00.334618,256,,1.9414524659601569,sgd,1.378780036461803e-07,4.0,COMPLETE
50,0.7777065967798688,2026-09-27 09:02:23.005703,2026-09-27 09:02:23.858000,0 days 00:00:00.852297,64,,1.9852416202180232,sgd,1.8526059243037218e-06,1.0,COMPLETE
51,0.7777721156529441,2026-09-27 09:02:23.037914,2026-09-27 09:02:23.630001,0 days 00:00:00.592087,128,,1.847866490677766,sgd,1.017646992497465e-07,3.0,COMPLETE
52,0.7776289447821498,2026-09-27 09:02:23.046971,2026-09-27 09:02:23.905674,0 days 00:00:00.858703,64,,1.93214539697263,sgd,1.0245465418961551e-07,1.0,COMPLETE
53,0.6225949113675244,2026-09-27 09:02:23.110480,2026-09-27 09:02:23.770952,0 days 00:00:00.660472,64,0.00030818140292295995,,adam,0.05020503989116409,,PRUNED
54,0.7776204515948992,2026-09-27 09:02:23.217583,2026-09-27 09:02:24.065331,0 days 00:00:00.847748,64,,1.937192340133021,sgd,1.127540795201724e-06,1.0,COMPLETE
55,0.7775221732852862,2026-09-27 09:02:23.285692,2026-09-27 09:02:24.292589,0 days 00:00:01.006897,64,,0.8892934085633415,sgd,1.2477695650215417e-07,3.0,COMPLETE
56,0.6610641963624893,2026-09-27 09:02:23.308577,2026-09-27 09:02:24.453818,0 days 00:00:01.145241,32,0.0004214231677344634,,adam,0.015148416333937202,,PRUNED
57,0.7771242067969764,2026-09-27 09:02:23.336013,2026-09-27 09:02:24.255304,0 days 00:00:00.919291,32,,0.965924922166113,sgd,1.0014889975033533e-07,,PRUNED
58,0.7777320763416203,2026-09-27 09:02:23.631049,2026-09-27 09:02:24.205454,0 days 00:00:00.574405,128,,1.937082890058855,sgd,2.056680499547119e-07,3.0,COMPLETE
59,0.7776956769676895,2026-09-27 09:02:23.771835,2026-09-27 09:02:24.308081,0 days 00:00:00.536246,128,,1.9588276903007857,sgd,6.064435875954708e-07,3.0,COMPLETE
60,0.7778509809631275,2026-09-27 09:02:23.859137,2026-09-27 09:02:24.378233,0 days 00:00:00.519096,128,,1.8096556742423782,sgd,3.5945335426002995e-07,3.0,COMPLETE
61,0.7776714107184023,2026-09-27 09:02:23.908410,2026-09-27 09:02:24.732607,0 days 00:00:00.824197,64,,1.955677141748186,sgd,3.1535115366755277e-06,1.0,COMPLETE
62,0.7767941858066707,2026-09-27 09:02:24.066264,2026-09-27 09:02:24.344535,0 days 00:00:00.278271,128,,0.9336922245549035,sgd,1.5525107270447946e-07,,PRUNED
63,0.6955337968186948,2026-09-27 09:02:24.206305,2026-09-27 09:02:24.432954,0 days 00:00:00.226649,128,,0.05099205798417507,sgd,1.260958703746849e-07,,PRUNED
64,0.7768111721811718,2026-09-27 09:02:24.259115,2026-09-27 09:02:24.499176,0 days 00:00:00.240061,128,,0.905790199050763,sgd,1.1476229741814727e-07,,PRUNED
65,0.7768402916803164,2026-09-27 09:02:24.293677,2026-09-27 09:02:24.570960,0 days 00:00:00.277283,128,,0.9533440803382863,sgd,1.618755965661432e-06,,PRUNED
66,0.7777296497166917,2026-09-27 09:02:24.309191,2026-09-27 09:02:24.855172,0 days 00:00:00.545981,128,,1.942865027373745,sgd,2.8616643750360735e-06,3.0,COMPLETE
67,0.7774287482255304,2026-09-27 09:02:24.345658,2026-09-27 09:02:25.363604,0 days 00:00:01.017946,64,,0.8253417360910075,sgd,6.1904265745539215e-06,3.0,COMPLETE
68,0.7777029568424757,2026-09-27 09:02:24.379294,2026-09-27 09:02:24.967801,0 days 00:00:00.588507,128,,1.9651037700025509,sgd,3.664453037717012e-07,3.0,COMPLETE
69,0.7777345029665491,2026-09-27 09:02:24.434189,2026-09-27 09:02:25.044757,0 days 00:00:00.610568,128,,1.9215335353376057,sgd,1.7651867401450698e-07,3.0,COMPLETE
70,0.7776987102488504,2026-09-27 09:02:24.454814,2026-09-27 09:02:25.036540,0 days 00:00:00.581726,128,,1.9677949742844225,sgd,1.6517929038357116e-07,3.0,COMPLETE
71,0.5458619978403038,2026-09-27 09:02:24.500363,2026-09-27 09:02:24.917346,0 days 00:00:00.416983,128,0.000131922963838113,,adam,2.8073439219876083e-07,,PRUNED
72,0.7029956684745022,2026-09-27 09:02:24.573515,2026-09-27 09:02:25.644790,0 days 00:00:01.071275,32,0.0014916543375569683,,adam,7.187340854611572e-06,,PRUNED
73,0.7268336184617623,2026-09-27 09:02:24.733418,2026-09-27 09:02:25.419019,0 days 00:00:00.685601,64,0.004365965572328624,,adam,2.6392289631785365e-06,,PRUNED
74,0.7468678338732574,2026-09-27 09:02:24.856196,2026-09-27 09:02:25.140320,0 days 00:00:00.284124,128,,0.19060675763638482,sgd,1.8064566971032808e-05,,PRUNED
75,0.6562054865989639,2026-09-27 09:02:24.918348,2026-09-27 09:02:25.205144,0 days 00:00:00.286796,128,,0.012271868582579983,sgd,1.67446511524863e-06,,PRUNED
76,0.7768330118055303,2026-09-27 09:02:24.969163,2026-09-27 09:02:25.238600,0 days 00:00:00.269437,128,,0.9241039050342931,sgd,1.931661622606427e-06,,PRUNED
77,0.7769337167400722,2026-09-27 09:02:25.037514,2026-09-27 09:02:25.298910,0 days 00:00:00.261396,128,,0.9794144945677006,sgd,1.3907193644043317e-07,,PRUNED
78,0.777730863029156,2026-09-27 09:02:25.045587,2026-09-27 09:02:25.596127,0 days 00:00:00.550540,128,,1.9281633552122999,sgd,1.1518791041798376e-07,3.0,COMPLETE
79,0.7777417828413351,2026-09-27 09:02:25.141582,2026-09-27 09:02:26.023283,0 days 00:00:00.881701,128,,1.8680153907500394,sgd,2.666906884807959e-06,3.0,COMPLETE
80,0.7777078100923331,2026-09-27 09:02:25.206508,2026-09-27 09:02:26.119824,0 days 00:00:00.913316,128,,1.972941210124441,sgd,1.306958534038206e-06,3.0,COMPLETE
81,0.7778400611509483,2026-09-27 09:02:25.239504,2026-09-27 09:02:26.156444,0 days 00:00:00.916940,128,,1.8112314470404554,sgd,5.653301983879803e-07,3.0,COMPLETE
82,0.7775100401606426,2026-09-27 09:02:25.299757,2026-09-27 09:02:26.812902,0 days 00:00:01.513145,64,,0.9970833939145487,sgd,4.468816193291223e-06,3.0,COMPLETE
83,0.7776665574685449,2026-09-27 09:02:25.364918,2026-09-27 09:02:26.298196,0 days 00:00:00.933278,128,,1.9914583559612133,sgd,1.0101601380233604e-07,3.0,COMPLETE
84,0.7769731493951637,2026-09-27 09:02:25.420149,2026-09-27 09:02:25.929823,0 days 00:00:00.509674,128,,1.0197744095167331,sgd,1.865019534120975e-06,,PRUNED
85,0.7777369295914778,2026-09-27 09:02:25.599512,2026-09-27 09:02:26.656948,0 days 00:00:01.057436,128,,1.9192882543573604,sgd,1.0368732929192815e-07,3.0,COMPLETE
86,0.7776532110314368,2026-09-27 09:02:25.646348,2026-09-27 09:02:26.734275,0 days 00:00:01.087927,128,,1.9958957308504497,sgd,1.3172739734246604e-07,3.0,COMPLETE
87,0.7767177471214162,2026-09-27 09:02:25.935715,2026-09-27 09:02:26.336209,0 days 00:00:00.400494,128,,0.8911304053130392,sgd,1.3469517308609428e-07,,PRUNED
88,0.7769337167400721,2026-09-27 09:02:26.035145,2026-09-27 09:02:26.455177,0 days 00:00:00.420032,128,,0.9936800350602153,sgd,4.451002453105022e-05,,PRUNED
89,0.7776677707810093,2026-09-27 09:02:26.126423,2026-09-27 09:02:26.940146,0 days 00:00:00.813723,128,,1.9917523790695222,sgd,4.215442272741585e-06,3.0,COMPLETE
90,0.7777029568424757,2026-09-27 09:02:26.185388,2026-09-27 09:02:26.923407,0 days 00:00:00.738019,128,,1.961044523199733,sgd,4.2996039893009595e-06,3.0,COMPLETE
91,0.7777357162790133,2026-09-27 09:02:26.300523,2026-09-27 09:02:27.061947,0 days 00:00:00.761424,128,,1.9194297443359927,sgd,1.6376350303390654e-06,3.0,COMPLETE
92,0.7770089421128623,2026-09-27 09:02:26.348605,2026-09-27 09:02:26.793026,0 days 00:00:00.444421,128,,1.0287920182009869,sgd,2.229785080689612e-06,,PRUNED
93,0.6218942234193572,2026-09-27 09:02:26.461274,2026-09-27 09:02:26.909897,0 days 00:00:00.448623,128,0.0006100317919043574,,adam,2.457222430601371e-06,,PRUNED
94,0.7776920370302964,2026-09-27 09:02:26.659479,2026-09-27 09:02:27.261099,0 days 00:00:00.601620,128,,1.9519782528333245,sgd,1.0729963795869816e-07,3.0,COMPLETE
95,0.7770465547992574,2026-09-27 09:02:26.735895,2026-09-27 09:02:27.042467,0 days 00:00:00.306572,128,,1.0671717160903742,sgd,1.474304109889223e-07,,PRUNED
96,0.7777527026535143,2026-09-27 09:02:26.794361,2026-09-27 09:02:27.403713,0 days 00:00:00.609352,128,,1.9108181628204015,sgd,6.449802055748613e-07,3.0,COMPLETE
97,0.7777078100923331,2026-09-27 09:02:26.813934,2026-09-27 09:02:27.430696,0 days 00:00:00.616762,128,,1.9638907508147216,sgd,1.0644218060476432e-07,3.0,COMPLETE
98,0.7778242880889115,2026-09-27 09:02:26.911332,2026-09-27 09:02:27.538369,0 days 00:00:00.627037,128,,1.7707473425130729,sgd,1.8703200755311064e-06,3.0,COMPLETE
99,0.7777672624030866,2026-09-27 09:02:26.928535,2026-09-27 09:02:27.529799,0 days 00:00:00.601264,128,,1.8971775224719674,sgd,1.1375260596470822e-06,3.0,COMPLETE
100,0.7777041701549401,2026-09-27 09:02:26.942823,2026-09-27 09:02:27.520502,0 days 00:00:00.577679,128,,1.9473870482606637,sgd,8.722830669088228e-07,3.0,COMPLETE
101,0.7769422099273227,2026-09-27 09:02:27.043650,2026-09-27 09:02:27.309979,0 days 00:00:00.266329,128,,0.9826138146088631,sgd,1.0630285942309891e-07,,PRUNED
102,0.7776726240308666,2026-09-27 09:02:27.062755,2026-09-27 09:02:27.633626,0 days 00:00:00.570871,128,,1.9897114576751678,sgd,1.707898831894968e-06,3.0,COMPLETE
103,0.7728673000157731,2026-09-27 09:02:27.262826,2026-09-27 09:02:27.629845,0 days 00:00:00.367019,128,0.026542818678982387,,adam,1.5842330204700133e-07,,PRUNED
104,0.7768597046797462,2026-09-27 09:02:27.311013,2026-09-27 09:02:27.624601,0 days 00:00:00.313588,128,,0.9623470696040903,sgd,9.153246808906892e-07,,PRUNED
105,0.7770465547992574,2026-09-27 09:02:27.404808,2026-09-27 09:02:27.673596,0 days 00:00:00.268788,128,,1.0618668242606901,sgd,1.322794315967913e-07,,PRUNED
106,0.7777502760285857,2026-09-27 09:02:27.431544,2026-09-27 09:02:28.049448,0 days 00:00:00.617904,128,,1.9122816463317973,sgd,4.494708058161865e-07,3.0,COMPLETE
107,0.7777017435300113,2026-09-27 09:02:27.521571,2026-09-27 09:02:28.100845,0 days 00:00:00.579274,128,,1.9610067197051682,sgd,3.100109736606311e-06,3.0,COMPLETE
