number,value,datetime_start,datetime_complete,duration,params_batch_size,params_local_epochs,params_lr_adam,params_lr_sgd,params_optimizer,params_weight_decay,user_attrs_best_round,state
0,0.5963740157002633,2026-09-26 10:42:07.219100,2026-09-26 10:50:10.191808,0 days 00:08:02.972708,64,1,0.00010007903854383786,,adam,3.27466657122539e-05,1000.0,COMPLETE
1,0.5,2026-09-26 10:42:07.220040,2026-09-26 10:42:11.022375,0 days 00:00:03.802335,64,10,,1.730517074045618,sgd,0.004745669949715015,,COMPLETE
2,0.6656474841966051,2026-09-26 10:42:07.219146,2026-09-26 11:00:27.122145,0 days 00:18:19.902999,32,5,0.006431172050131994,,adam,0.0056279499752231385,,PRUNED
3,0.6532207379366408,2026-09-26 10:42:07.220476,2026-09-26 10:59:54.926545,0 days 00:17:47.706069,64,5,0.0007459577266393833,,adam,1.51097495316778e-07,,PRUNED
4,0.7554447396838108,2026-09-26 10:42:07.219201,2026-09-26 10:50:14.827030,0 days 00:08:07.607829,16,1,,0.18398814851291084,sgd,0.0005330930205460225,980.0,COMPLETE
5,0.6697933728873198,2026-09-26 10:42:07.226532,2026-09-26 10:42:51.845857,0 days 00:00:44.619325,64,5,,0.7756625889761463,sgd,4.254500280767681e-05,35.0,COMPLETE
6,0.643861245586576,2026-09-26 10:42:07.227562,2026-09-26 10:55:02.123646,0 days 00:12:54.896084,64,2,0.002066463288698666,,adam,0.0011895425372303978,190.0,COMPLETE
7,0.6295793445686069,2026-09-26 10:42:07.227003,2026-09-26 10:52:14.907010,0 days 00:10:07.680007,16,1,0.0004170205589203407,,adam,3.0510379709992126e-07,1000.0,COMPLETE
8,0.6371164415972046,2026-09-26 10:42:07.235359,2026-09-26 10:50:47.590807,0 days 00:08:40.355448,32,1,0.0405119940896805,,adam,0.00021485172403017103,22.0,COMPLETE
9,0.7674158871134082,2026-09-26 10:42:11.024921,2026-09-26 10:56:33.647531,0 days 00:14:22.622610,32,2,0.08916656398688455,,adam,0.0494155735782982,742.0,COMPLETE
10,0.7781688688287896,2026-09-26 10:42:51.847374,2026-09-26 10:56:14.522175,0 days 00:13:22.674801,16,2,,0.21476870693209232,sgd,0.0020503283624386296,982.0,COMPLETE
11,0.7509130176294301,2026-09-26 10:50:10.194473,2026-09-26 10:59:54.894297,0 days 00:09:44.699824,64,2,,1.0485147899840868,sgd,0.06450144652189366,15.0,COMPLETE
12,0.7194269525230832,2026-09-26 10:50:14.830744,2026-09-26 11:08:15.047118,0 days 00:18:00.216374,16,5,,0.15197027947763847,sgd,2.464444410098696e-07,,PRUNED
13,0.7525097368325265,2026-09-26 10:50:47.593200,2026-09-26 11:29:54.543476,0 days 00:39:06.950276,16,10,0.013712723599669366,,adam,0.07892657903676713,,PRUNED
14,0.6243250949417003,2026-09-26 10:52:14.911167,2026-09-26 10:56:37.097522,0 days 00:04:22.186355,16,1,,0.023135332962078183,sgd,3.934727903989159e-06,,PRUNED
15,0.6220913866948155,2026-09-26 10:55:02.139430,2026-09-26 10:57:39.863453,0 days 00:02:37.724023,16,2,,0.014181478537596536,sgd,0.050208471750119374,,PRUNED
16,0.7340528276246981,2026-09-26 10:56:14.528213,2026-09-26 11:09:23.336538,0 days 00:13:08.808325,64,5,,0.42828555741380375,sgd,3.4173096550190386e-06,,PRUNED
17,0.6441026947669832,2026-09-26 10:56:33.649319,2026-09-26 11:06:24.343374,0 days 00:09:50.694055,64,10,0.00033074726717910533,,adam,0.0001349511950184824,,PRUNED
18,0.6728315072980744,2026-09-26 10:56:37.100669,2026-09-26 11:07:31.136245,0 days 00:10:54.035576,16,5,0.0037867943753492053,,adam,0.00013298231668799895,,PRUNED
19,0.623786384207525,2026-09-26 10:57:39.865091,2026-09-26 11:00:28.342124,0 days 00:02:48.477033,32,2,0.09779616710544127,,adam,0.009317726026024587,,PRUNED
20,0.6517150171683714,2026-09-26 10:59:54.895671,2026-09-26 11:01:58.105168,0 days 00:02:03.209497,32,2,,0.06230367236063513,sgd,0.0001095514460895184,,PRUNED
21,0.7237384583651827,2026-09-26 10:59:54.928058,2026-09-26 11:07:35.883813,0 days 00:07:40.955755,16,2,,0.07394338751148355,sgd,7.851630861363967e-05,,PRUNED
22,0.745338453511933,2026-09-26 11:00:27.123506,2026-09-26 11:07:01.018565,0 days 00:06:33.895059,32,1,,0.32522236287064604,sgd,0.04959172160979626,86.0,COMPLETE
23,0.5490342032783703,2026-09-26 11:00:28.343858,2026-09-26 11:03:35.674172,0 days 00:03:07.330314,16,2,0.09130651024362613,,adam,0.0012203935273117827,,PRUNED
24,0.6941045147356799,2026-09-26 11:01:58.107610,2026-09-26 11:17:17.172710,0 days 00:15:19.065100,32,10,0.022423289172534548,,adam,0.017202466958121908,,PRUNED
25,0.6994491561411811,2026-09-26 11:03:35.677763,2026-09-26 11:18:01.879251,0 days 00:14:26.201488,32,10,,0.05757450993837208,sgd,3.169538769432036e-06,,PRUNED
26,0.7716667273322899,2026-09-26 11:06:24.345670,2026-09-26 11:16:11.972186,0 days 00:09:47.626516,32,1,0.015480502827474856,,adam,0.043501437690903394,333.0,COMPLETE
27,0.6687280845436125,2026-09-26 11:07:01.020397,2026-09-26 11:19:02.308396,0 days 00:12:01.287999,16,10,,0.010715834905879712,sgd,0.0020801608175550984,,PRUNED
28,0.6594498841286597,2026-09-26 11:07:31.137845,2026-09-26 11:14:00.094583,0 days 00:06:28.956738,64,5,0.09748825791991388,,adam,0.07301065404159644,,PRUNED
29,0.7244179133452238,2026-09-26 11:07:35.885460,2026-09-26 11:12:02.167571,0 days 00:04:26.282111,16,1,,0.23617586685099842,sgd,0.0002361893125064389,,PRUNED
30,0.7853395454931509,2026-09-26 11:08:15.048409,2026-09-26 11:17:20.391956,0 days 00:09:05.343547,16,1,,0.14586756276351537,sgd,0.008686809107072178,980.0,COMPLETE
31,0.7736322935245514,2026-09-26 11:09:23.338958,2026-09-26 11:29:13.319997,0 days 00:19:49.981039,16,5,,0.2338264425222806,sgd,0.002300062848904431,892.0,COMPLETE
32,0.7813295477984445,2026-09-26 11:12:02.169090,2026-09-26 11:23:00.425871,0 days 00:10:58.256781,32,2,,0.111193643888104,sgd,0.004913073127655248,984.0,COMPLETE
33,0.7386706948640482,2026-09-26 11:14:00.097149,2026-09-26 11:21:09.693940,0 days 00:07:09.596791,32,2,0.007764476344726993,,adam,0.08100379100448613,,PRUNED
34,0.7522755675269052,2026-09-26 11:16:11.973695,2026-09-26 11:23:27.260264,0 days 00:07:15.286569,32,1,0.024324270235268435,,adam,0.011801431204105997,,PRUNED
35,0.7733890243754473,2026-09-26 11:17:17.174889,2026-09-26 11:23:38.066737,0 days 00:06:20.891848,64,1,0.018980286884991624,,adam,0.0791613449960528,364.0,COMPLETE
36,0.7470844101481455,2026-09-26 11:17:20.393439,2026-09-26 11:22:52.986575,0 days 00:05:32.593136,16,1,,0.45815176913751715,sgd,0.07775790328573691,,PRUNED
37,0.6505459906089616,2026-09-26 11:18:01.885074,2026-09-26 11:20:13.770283,0 days 00:02:11.885209,16,1,0.002156267521018066,,adam,0.010532063217863605,,PRUNED
