number,value,datetime_start,datetime_complete,duration,params_batch_size,params_local_epochs,params_lr_adam,params_lr_sgd,params_mu,params_optimizer,params_weight_decay,user_attrs_best_round,state
0,0.6424683628774918,2026-09-26 13:09:59.783413,2026-09-26 13:31:27.426706,0 days 00:21:27.643293,32,5,0.006431172050131994,,0.03860866271460544,adam,0.0056279499752231385,,PRUNED
1,0.5963600626069232,2026-09-26 13:09:59.805450,2026-09-26 13:17:58.133157,0 days 00:07:58.327707,64,1,0.00010007903854383786,,0.11367330868956228,adam,3.27466657122539e-05,998.0,COMPLETE
2,0.7560162098545238,2026-09-26 13:09:59.810263,2026-09-26 13:18:06.315936,0 days 00:08:06.505673,16,1,,0.18398814851291084,0.03867464027059847,sgd,0.0005330930205460225,982.0,COMPLETE
3,0.6535167861779444,2026-09-26 13:09:59.813641,2026-09-26 13:31:33.641029,0 days 00:21:33.827388,64,5,0.0007459577266393833,,0.023469274965727698,adam,1.51097495316778e-07,,PRUNED
4,0.5,2026-09-26 13:09:59.814746,2026-09-26 13:10:05.231460,0 days 00:00:05.416714,64,10,,1.730517074045618,0.003917916931928581,sgd,0.004745669949715015,,COMPLETE
5,0.6295490117569977,2026-09-26 13:09:59.825171,2026-09-26 13:20:14.607489,0 days 00:10:14.782318,16,1,0.0004170205589203407,,0.16418024091157923,adam,3.0510379709992126e-07,998.0,COMPLETE
6,0.5718105048593165,2026-09-26 13:09:59.832275,2026-09-26 13:10:12.770217,0 days 00:00:12.937942,64,5,,0.7756625889761463,0.1613044389898987,sgd,4.254500280767681e-05,5.0,COMPLETE
7,0.6591611157621423,2026-09-26 13:09:59.861750,2026-09-26 13:22:57.508008,0 days 00:12:57.646258,64,2,0.002066463288698666,,0.25776094086318263,adam,0.0011895425372303978,742.0,COMPLETE
8,0.6381999296278771,2026-09-26 13:09:59.860140,2026-09-26 13:18:45.420399,0 days 00:08:45.560259,32,1,0.0405119940896805,,0.04267347919781316,adam,0.00021485172403017103,18.0,COMPLETE
9,0.640234654630607,2026-09-26 13:10:05.233379,2026-09-26 13:20:22.398598,0 days 00:10:17.165219,16,1,0.00031011782129708893,,0.3970707496057747,adam,0.00522198855455421,778.0,COMPLETE
10,0.7257495237748578,2026-09-26 13:10:12.771733,2026-09-26 13:20:26.463672,0 days 00:10:13.691939,16,1,0.008631082894759624,,0.1618899658432487,adam,0.006501646824889724,105.0,COMPLETE
11,0.5663469588323081,2026-09-26 13:17:58.140878,2026-09-26 13:20:23.799357,0 days 00:02:25.658479,64,1,0.00012082666253305466,,0.11938997108268636,adam,7.595302389085044e-06,,PRUNED
12,0.613913054028804,2026-09-26 13:18:06.317814,2026-09-26 13:21:04.674184,0 days 00:02:58.356370,32,2,0.0003575358516942409,,0.001948017019787817,adam,3.704537245820391e-05,,PRUNED
13,0.7492362198036859,2026-09-26 13:18:45.428750,2026-09-26 13:38:52.839395,0 days 00:20:07.410645,64,5,,0.26662882015738504,0.009255340046547161,sgd,5.84970920705079e-07,891.0,COMPLETE
14,0.5,2026-09-26 13:20:14.609608,2026-09-26 13:20:18.279823,0 days 00:00:03.670215,32,10,,1.0586721856983903,0.005764539472148938,sgd,5.106405319596822e-06,,COMPLETE
15,0.5600735267353402,2026-09-26 13:20:18.284480,2026-09-26 13:21:35.032590,0 days 00:01:16.748110,64,1,,0.024048066339140285,0.05407400967295432,sgd,1.3727724495084213e-07,,PRUNED
16,0.739021342166248,2026-09-26 13:20:22.399899,2026-09-26 13:33:12.587327,0 days 00:12:50.187428,16,2,,0.24117207587711176,0.043212356974215806,sgd,8.898984352047325e-07,982.0,COMPLETE
17,0.6313155947051045,2026-09-26 13:20:23.800651,2026-09-26 13:26:24.181014,0 days 00:06:00.380363,32,5,0.00017994203765849884,,0.00884192634891773,adam,0.0014166503840925472,,PRUNED
18,0.7158033948482752,2026-09-26 13:20:26.465060,2026-09-26 13:36:58.246935,0 days 00:16:31.781875,16,5,,0.06670516651944028,0.007223574632476403,sgd,0.00025924841995373054,,PRUNED
19,0.7790630801150219,2026-09-26 13:21:04.675899,2026-09-26 13:30:50.466284,0 days 00:09:45.790385,16,1,0.07129439007411074,,0.017313728464657275,adam,0.08998522793041448,460.0,COMPLETE
20,0.5599594753636905,2026-09-26 13:21:35.033720,2026-09-26 13:23:09.442514,0 days 00:01:34.408794,16,1,,0.010022087232449226,0.7028691371477299,sgd,0.0002560629674717335,,PRUNED
21,0.6317766534415608,2026-09-26 13:22:57.509457,2026-09-26 13:24:29.691300,0 days 00:01:32.181843,16,1,,0.07251775252704232,0.03197494556241388,sgd,0.0002574129144975548,,PRUNED
22,0.7463897887623,2026-09-26 13:23:09.445875,2026-09-26 14:03:32.402533,0 days 00:40:22.956658,16,10,0.011063155976210324,,0.10546867086665344,adam,0.000767435620642621,,PRUNED
23,0.7707834358582366,2026-09-26 13:24:29.692700,2026-09-26 13:30:40.849114,0 days 00:06:11.156414,64,1,,0.16141359592020948,0.13530824252554885,sgd,0.006308686961084103,983.0,COMPLETE
24,0.7714022252150596,2026-09-26 13:26:24.182196,2026-09-26 13:39:03.919802,0 days 00:12:39.737606,16,2,,0.0420026867916613,0.027915199551757745,sgd,0.005478296014219815,983.0,COMPLETE
25,0.7487581746927287,2026-09-26 13:30:40.850124,2026-09-26 13:36:42.437250,0 days 00:06:01.587126,64,1,,0.18655568144069934,0.04140866309265186,sgd,0.06507648555573547,194.0,COMPLETE
26,0.7150911804316966,2026-09-26 13:30:50.470228,2026-09-26 13:36:52.276264,0 days 00:06:01.806036,64,1,0.08744701461795569,,0.0011511527942954349,adam,0.04527651686058166,,PRUNED
27,0.778985428117303,2026-09-26 13:31:27.428554,2026-09-26 13:47:13.170985,0 days 00:15:45.742431,16,2,0.061506507179026906,,0.0037428261921387917,adam,0.020567131361235485,543.0,COMPLETE
28,0.750879044880428,2026-09-26 13:31:33.642450,2026-09-26 13:44:23.588401,0 days 00:12:49.945951,16,2,,0.518828488911865,0.7262860396093556,sgd,0.06953798263403356,25.0,COMPLETE
29,0.7620051201785996,2026-09-26 13:33:12.588659,2026-09-26 13:43:07.498789,0 days 00:09:54.910130,16,1,0.01945318901857304,,0.011202970246612131,adam,0.009695026882255481,916.0,COMPLETE
30,0.6255183877503974,2026-09-26 13:36:42.439159,2026-09-26 13:37:56.609881,0 days 00:01:14.170722,64,1,,0.12133505546397542,0.2933214763545886,sgd,0.004000220576011835,,PRUNED
31,0.7726391972724735,2026-09-26 13:36:52.277870,2026-09-26 14:05:12.728834,0 days 00:28:20.450964,32,10,,0.17328092712846635,0.10908897031286632,sgd,0.002299440645130975,892.0,COMPLETE
32,0.7652944102694768,2026-09-26 13:36:58.249012,2026-09-26 13:46:22.172249,0 days 00:09:23.923237,16,1,0.002574056528207031,,0.03557372154411542,adam,0.06655124094946907,708.0,COMPLETE
33,0.7478384838447446,2026-09-26 13:37:56.618932,2026-09-26 13:44:58.056255,0 days 00:07:01.437323,16,1,,0.34368646443611045,0.01177951221518993,sgd,0.05486694941230986,,PRUNED
34,0.7676391366068505,2026-09-26 13:38:52.841219,2026-09-26 14:08:59.973584,0 days 00:30:07.132365,32,10,0.08576384155157253,,0.005919139440071262,adam,0.0658002178348513,177.0,COMPLETE
35,0.6418392603647217,2026-09-26 13:39:03.921141,2026-09-26 13:41:39.693359,0 days 00:02:35.772218,16,2,,0.03913862694721415,0.021010098615312275,sgd,0.0038515923071297743,,PRUNED
36,0.7489104454070057,2026-09-26 13:41:39.695286,2026-09-26 13:58:44.036234,0 days 00:17:04.340948,16,5,,0.02990327642881725,0.05189625032622552,sgd,0.047522074953549466,,PRUNED
37,0.7496099200427087,2026-09-26 13:43:07.500208,2026-09-26 14:05:38.560943,0 days 00:22:31.060735,64,10,,0.04783526083819585,0.6749526935847683,sgd,0.06353841553044551,,PRUNED
