number,value,datetime_start,datetime_complete,duration,params_batch_size,params_local_epochs,params_lr_adam,params_lr_sgd,params_optimizer,params_weight_decay,user_attrs_best_round,state
0,0.7294155473859183,2026-09-26 12:24:00.246977,2026-09-26 12:47:33.960859,0 days 00:23:33.713882,32,5,0.006431172050131994,,adam,0.0056279499752231385,,PRUNED
1,0.59629515039008,2026-09-26 12:24:00.250670,2026-09-26 12:31:35.576152,0 days 00:07:35.325482,64,1,0.00010007903854383786,,adam,3.27466657122539e-05,1000.0,COMPLETE
2,0.7537764350453171,2026-09-26 12:24:00.251943,2026-09-26 12:31:39.159521,0 days 00:07:38.907578,16,1,,0.18398814851291084,sgd,0.0005330930205460225,982.0,COMPLETE
3,0.684525412829566,2026-09-26 12:24:00.252070,2026-09-26 12:43:35.860782,0 days 00:19:35.608712,64,5,0.0007459577266393833,,adam,1.51097495316778e-07,,PRUNED
4,0.5,2026-09-26 12:24:00.260034,2026-09-26 12:24:04.818615,0 days 00:00:04.558581,64,10,,1.730517074045618,sgd,0.004745669949715015,,COMPLETE
5,0.6300525364297067,2026-09-26 12:24:00.274811,2026-09-26 12:33:47.834629,0 days 00:09:47.559818,16,1,0.0004170205589203407,,adam,3.0510379709992126e-07,998.0,COMPLETE
6,0.7068030429876606,2026-09-26 12:24:00.282081,2026-09-26 12:29:40.581978,0 days 00:05:40.299897,64,5,,0.7756625889761463,sgd,4.254500280767681e-05,282.0,COMPLETE
7,0.6701039808781956,2026-09-26 12:24:00.283272,2026-09-26 12:36:16.631606,0 days 00:12:16.348334,64,2,0.002066463288698666,,adam,0.0011895425372303978,373.0,COMPLETE
8,0.7434602458171053,2026-09-26 12:24:00.306045,2026-09-26 12:32:16.222138,0 days 00:08:15.916093,32,1,0.0405119940896805,,adam,0.00021485172403017103,508.0,COMPLETE
9,0.5867287882648419,2026-09-26 12:24:04.820688,2026-09-26 12:37:53.283235,0 days 00:13:48.462547,32,2,0.08916656398688455,,adam,0.0494155735782982,136.0,COMPLETE
10,0.7643941324209224,2026-09-26 12:29:40.583411,2026-09-26 12:42:28.085063,0 days 00:12:47.501652,16,2,,0.21476870693209232,sgd,0.0020503283624386296,982.0,COMPLETE
11,0.7592800203836494,2026-09-26 12:31:35.578919,2026-09-26 12:41:17.064889,0 days 00:09:41.485970,64,2,,1.0485147899840868,sgd,0.06450144652189366,31.0,COMPLETE
12,0.7126681954403717,2026-09-26 12:31:39.164215,2026-09-26 12:46:49.529857,0 days 00:15:10.365642,16,5,,0.15197027947763847,sgd,2.464444410098696e-07,,PRUNED
13,0.7738610029240831,2026-09-26 12:32:16.232803,2026-09-26 13:09:54.817327,0 days 00:37:38.584524,16,10,0.013712723599669366,,adam,0.07892657903676713,606.0,COMPLETE
14,0.6238306701124741,2026-09-26 12:33:47.836776,2026-09-26 12:38:05.838082,0 days 00:04:18.001306,16,1,,0.023135332962078183,sgd,3.934727903989159e-06,,PRUNED
15,0.6193359540882564,2026-09-26 12:36:16.633548,2026-09-26 12:38:53.753788,0 days 00:02:37.120240,16,2,,0.014181478537596536,sgd,0.050208471750119374,,PRUNED
16,0.6642097089263399,2026-09-26 12:37:53.285886,2026-09-26 12:47:39.358793,0 days 00:09:46.072907,64,10,0.00033074726717910533,,adam,0.0001349511950184824,,PRUNED
17,0.7567696768948907,2026-09-26 12:38:05.839288,2026-09-26 12:57:48.783127,0 days 00:19:42.943839,64,5,,0.056719771048164364,sgd,0.001581472646849113,968.0,COMPLETE
18,0.7594632305657676,2026-09-26 12:38:53.755425,2026-09-26 12:46:29.558640,0 days 00:07:35.803215,16,1,,0.2435089360677308,sgd,0.0008695272967821103,982.0,COMPLETE
19,0.755148084786275,2026-09-26 12:41:17.078089,2026-09-26 12:50:42.807954,0 days 00:09:25.729865,64,2,,0.8130012073288694,sgd,0.06302534658163611,32.0,COMPLETE
20,0.7190344459408632,2026-09-26 12:42:28.090802,2026-09-26 12:48:14.085548,0 days 00:05:45.994746,32,2,,0.49065901503116444,sgd,0.001725338322438422,,PRUNED
21,0.5,2026-09-26 12:43:35.862178,2026-09-26 12:43:38.368622,0 days 00:00:02.506444,16,2,,1.5656815651804519,sgd,1.5981823825278003e-05,1.0,COMPLETE
22,0.7167376454458316,2026-09-26 12:43:38.371993,2026-09-26 12:48:45.649879,0 days 00:05:07.277886,64,2,,0.34435912654185263,sgd,0.00017226923209108887,,PRUNED
23,0.743726567903032,2026-09-26 12:46:29.560330,2026-09-26 12:51:41.796246,0 days 00:05:12.235916,32,1,,0.08678455841693315,sgd,0.038362871148571676,,PRUNED
24,0.6827994758490155,2026-09-26 12:46:49.531658,2026-09-26 12:59:14.976077,0 days 00:12:25.444419,16,10,,0.157715117461564,sgd,0.0016322641198490613,,PRUNED
25,0.6489741443113846,2026-09-26 12:47:33.963279,2026-09-26 12:49:28.009106,0 days 00:01:54.045827,16,1,0.005001787522376098,,adam,0.001215095308152635,,PRUNED
26,0.6735570681517611,2026-09-26 12:47:39.360214,2026-09-26 12:56:45.177184,0 days 00:09:05.816970,16,5,0.0017166619177749023,,adam,6.955128471391328e-05,,PRUNED
27,0.7125486841626323,2026-09-26 12:48:14.086982,2026-09-26 12:59:43.613773,0 days 00:11:29.526791,16,5,,0.2627207018824271,sgd,0.002054943787646009,,PRUNED
28,0.6291807714240647,2026-09-26 12:48:45.651479,2026-09-26 12:50:17.308609,0 days 00:01:31.657130,16,1,,0.05907654496910126,sgd,0.01149486065697954,,PRUNED
29,0.7473555854839297,2026-09-26 12:49:28.010489,2026-09-26 12:55:31.253551,0 days 00:06:03.243062,64,1,,0.4464681328536226,sgd,0.04370438449712398,,PRUNED
30,0.5654448610150571,2026-09-26 12:50:17.309811,2026-09-26 12:55:29.695159,0 days 00:05:12.385348,64,5,0.09891439771396811,,adam,0.04781597510510652,,PRUNED
31,0.7242650359747146,2026-09-26 12:50:42.809455,2026-09-26 12:57:37.393012,0 days 00:06:54.583557,16,2,,0.4007284188559068,sgd,0.0015516158314647637,,PRUNED
32,0.6813368276732306,2026-09-26 12:51:41.801159,2026-09-26 13:00:32.868398,0 days 00:08:51.067239,32,10,,0.18834868502426094,sgd,3.169538769432036e-06,,PRUNED
33,0.6580472949198608,2026-09-26 12:55:29.696819,2026-09-26 12:57:21.289418,0 days 00:01:51.592599,64,2,,0.8399433704924373,sgd,0.004057291106965887,,PRUNED
34,0.5,2026-09-26 12:55:31.254958,2026-09-26 12:55:35.004329,0 days 00:00:03.749371,64,2,,1.925003071380118,sgd,1.287084910520692e-07,3.0,COMPLETE
35,0.625973379924532,2026-09-26 12:55:35.006512,2026-09-26 12:58:35.697707,0 days 00:03:00.691195,16,2,0.012765121107584064,,adam,0.0016336578770321062,,PRUNED
36,0.6439850034579406,2026-09-26 12:56:45.179544,2026-09-26 13:02:28.222941,0 days 00:05:43.043397,32,10,0.00018394142820615285,,adam,1.4982676319224776e-07,,PRUNED
37,0.7283793785413558,2026-09-26 12:57:21.290611,2026-09-26 13:00:19.506768,0 days 00:02:58.216157,16,1,,0.3359263097989991,sgd,0.0003164991532454254,,PRUNED
