number,value,datetime_start,datetime_complete,duration,params_batch_size,params_local_epochs,params_lr_adam,params_lr_sgd,params_optimizer,params_weight_decay,user_attrs_best_round,state
0,0.7824142491415814,2026-09-27 09:02:38.238803,2026-09-27 09:25:19.967260,0 days 00:22:41.728457,32,5,0.006431172050131994,,adam,0.0056279499752231385,916.0,COMPLETE
1,0.6057504944248292,2026-09-27 09:02:38.286899,2026-09-27 09:09:49.742016,0 days 00:07:11.455117,64,1,0.00010007903854383786,,adam,3.27466657122539e-05,1000.0,COMPLETE
2,0.7918222739902208,2026-09-27 09:02:38.304218,2026-09-27 09:09:13.221356,0 days 00:06:34.917138,16,1,,0.18398814851291084,sgd,0.0005330930205460225,982.0,COMPLETE
3,0.6970043315254977,2026-09-27 09:02:38.367587,2026-09-27 09:12:54.084021,0 days 00:10:15.716434,64,5,0.0007459577266393833,,adam,1.51097495316778e-07,,PRUNED
4,0.6576735946808381,2026-09-27 09:02:38.465928,2026-09-27 09:11:06.304961,0 days 00:08:27.839033,16,1,0.0004170205589203407,,adam,3.0510379709992126e-07,1000.0,COMPLETE
5,0.6630776883970929,2026-09-27 09:02:38.479887,2026-09-27 09:03:06.731892,0 days 00:00:28.252005,64,5,,0.7756625889761463,sgd,4.254500280767681e-05,22.0,COMPLETE
6,0.7649140368119002,2026-09-27 09:02:38.480341,2026-09-27 09:12:44.244060,0 days 00:10:05.763719,64,2,0.002066463288698666,,adam,0.0011895425372303978,987.0,COMPLETE
7,0.5,2026-09-27 09:02:38.500569,2026-09-27 09:02:42.856235,0 days 00:00:04.355666,64,10,,1.730517074045618,sgd,0.004745669949715015,,COMPLETE
8,0.7658161346291511,2026-09-27 09:02:38.650258,2026-09-27 09:10:12.029998,0 days 00:07:33.379740,32,1,0.0405119940896805,,adam,0.00021485172403017103,366.0,COMPLETE
9,0.7317184144432716,2026-09-27 09:02:42.858851,2026-09-27 09:12:58.212369,0 days 00:10:15.353518,32,2,0.08916656398688455,,adam,0.0494155735782982,,PRUNED
10,0.7901479027894053,2026-09-27 09:03:06.750542,2026-09-27 09:12:24.019893,0 days 00:09:17.269351,16,2,,0.21476870693209232,sgd,0.0020503283624386296,811.0,COMPLETE
11,0.7712353947512104,2026-09-27 09:09:13.226148,2026-09-27 09:23:31.181424,0 days 00:14:17.955276,16,5,,0.15197027947763847,sgd,2.464444410098696e-07,,PRUNED
12,0.7245343913418023,2026-09-27 09:09:49.752902,2026-09-27 09:13:05.469750,0 days 00:03:15.716848,64,2,,1.0485147899840868,sgd,0.06450144652189366,,PRUNED
13,0.7543903711522828,2026-09-27 09:10:12.034141,2026-09-27 09:31:14.717418,0 days 00:21:02.683277,16,10,0.013712723599669366,,adam,0.07892657903676713,,PRUNED
14,0.6120918720198012,2026-09-27 09:11:06.307829,2026-09-27 09:12:58.946639,0 days 00:01:52.638810,16,1,,0.023135332962078183,sgd,3.934727903989159e-06,,PRUNED
15,0.7798153338429246,2026-09-27 09:12:24.022500,2026-09-27 09:22:54.223015,0 days 00:10:30.200515,64,5,,0.42828555741380375,sgd,3.4173096550190386e-06,346.0,COMPLETE
16,0.5795204989140854,2026-09-27 09:12:44.247524,2026-09-27 09:14:20.003867,0 days 00:01:35.756343,16,2,,0.014181478537596536,sgd,0.050208471750119374,,PRUNED
17,0.6222072580351617,2026-09-27 09:12:54.088277,2026-09-27 09:14:13.125064,0 days 00:01:19.036787,32,1,0.0006846393360094255,,adam,0.001441542695708797,,PRUNED
18,0.6303880173261021,2026-09-27 09:12:58.214375,2026-09-27 09:14:06.850490,0 days 00:01:08.636115,16,1,,0.0624549231715992,sgd,0.0010148336310293437,,PRUNED
19,0.6729328188888485,2026-09-27 09:12:58.948577,2026-09-27 09:15:20.457191,0 days 00:02:21.508614,16,2,0.005064483085196282,,adam,7.321181834025603e-05,,PRUNED
20,0.7838350380373458,2026-09-27 09:13:05.471250,2026-09-27 09:21:46.915215,0 days 00:08:41.443965,16,2,,0.16974749858773375,sgd,1.8831637278586903e-05,826.0,COMPLETE
21,0.7744603792814764,2026-09-27 09:14:06.852934,2026-09-27 09:32:31.617303,0 days 00:18:24.764369,16,10,,0.17293200042611293,sgd,3.263197805528207e-05,,PRUNED
22,0.6022136885912228,2026-09-27 09:14:13.126327,2026-09-27 09:15:11.326016,0 days 00:00:58.199689,32,1,,0.06799084131841,sgd,0.05384281237787248,,PRUNED
23,0.7938351593685922,2026-09-27 09:14:20.005333,2026-09-27 09:30:51.538150,0 days 00:16:31.532817,16,5,,0.3042643626496225,sgd,0.0018210736647671223,622.0,COMPLETE
24,0.6789902813671604,2026-09-27 09:15:11.333795,2026-09-27 09:16:50.625605,0 days 00:01:39.291810,16,2,,0.06719810249951648,sgd,0.0017497189772986,,PRUNED
25,0.784680716825004,2026-09-27 09:15:20.458819,2026-09-27 09:22:54.810788,0 days 00:07:34.351969,32,2,,0.37007780191575773,sgd,0.001929034842373744,811.0,COMPLETE
26,0.642712238682828,2026-09-27 09:16:50.630222,2026-09-27 09:17:50.550723,0 days 00:00:59.920501,64,1,,0.15902171790101619,sgd,0.0010707370335670706,,PRUNED
27,0.5881550370666957,2026-09-27 09:17:50.551926,2026-09-27 09:17:59.484817,0 days 00:00:08.932891,32,10,,0.4829081980154752,sgd,1.0295349872571724e-06,4.0,COMPLETE
28,0.6269919557383614,2026-09-27 09:17:59.486035,2026-09-27 09:19:38.241643,0 days 00:01:38.755608,16,1,0.09514692661659002,,adam,0.002231972054707476,,PRUNED
29,0.7541926012205923,2026-09-27 09:19:38.243096,2026-09-27 09:23:09.690810,0 days 00:03:31.447714,32,1,0.020792492144088216,,adam,6.809652047396249e-06,,PRUNED
30,0.7034470207112438,2026-09-27 09:21:46.918585,2026-09-27 09:23:30.101153,0 days 00:01:43.182568,16,2,,0.1506825914485413,sgd,9.504413437123286e-05,,PRUNED
31,0.7030442009730765,2026-09-27 09:22:54.231030,2026-09-27 09:25:06.505678,0 days 00:02:12.274648,16,2,,0.14731683615405713,sgd,4.319912862078793e-06,,PRUNED
32,0.7881113578179788,2026-09-27 09:22:54.812940,2026-09-27 09:30:08.963114,0 days 00:07:14.150174,32,2,,0.4869766294720386,sgd,0.0092448416236012,910.0,COMPLETE
33,0.7812822286123345,2026-09-27 09:23:09.692765,2026-09-27 09:30:03.852645,0 days 00:06:54.159880,32,2,,0.3720169639294187,sgd,0.00020328808313986184,,PRUNED
34,0.538744100268142,2026-09-27 09:23:30.102653,2026-09-27 09:25:15.192308,0 days 00:01:45.089655,64,1,0.00012197602078489526,,adam,0.0791613449960528,,PRUNED
35,0.7789186959317633,2026-09-27 09:23:31.194913,2026-09-27 09:32:21.574375,0 days 00:08:50.379462,32,5,,0.32989930067133316,sgd,0.0009005414961072216,,PRUNED
36,0.751977092660673,2026-09-27 09:25:06.513350,2026-09-27 09:32:49.202607,0 days 00:07:42.689257,16,10,,0.3336160901350829,sgd,0.008542356514961363,,PRUNED
37,0.6163360390201288,2026-09-27 09:25:15.194035,2026-09-27 09:26:21.908457,0 days 00:01:06.714422,32,1,,0.060306177812858144,sgd,0.0002410892407685206,,PRUNED
