number,value,datetime_start,datetime_complete,duration,params_batch_size,params_local_epochs,params_lr_adam,params_lr_sgd,params_optimizer,params_weight_decay,user_attrs_best_round,state
0,0.6571009111976607,2026-09-26 10:00:13.676195,2026-09-26 10:13:23.543788,0 days 00:13:09.867593,32,5,0.006431172050131994,,adam,0.0056279499752231385,,PRUNED
1,0.5967058566592656,2026-09-26 10:00:14.140369,2026-09-26 10:06:04.800241,0 days 00:05:50.659872,64,1,0.00010007903854383786,,adam,3.27466657122539e-05,1000.0,COMPLETE
2,0.7557614142370085,2026-09-26 10:00:14.148340,2026-09-26 10:05:34.738862,0 days 00:05:20.590522,16,1,,0.18398814851291084,sgd,0.0005330930205460225,982.0,COMPLETE
3,0.6301580946141059,2026-09-26 10:00:14.151142,2026-09-26 10:10:00.195530,0 days 00:09:46.044388,64,5,0.0007459577266393833,,adam,1.51097495316778e-07,,PRUNED
4,0.5,2026-09-26 10:00:14.186746,2026-09-26 10:00:19.256034,0 days 00:00:05.069288,64,10,,1.730517074045618,sgd,0.004745669949715015,,COMPLETE
5,0.6098884965845255,2026-09-26 10:00:14.222233,2026-09-26 10:07:19.921074,0 days 00:07:05.698841,16,1,0.0004170205589203407,,adam,3.0510379709992126e-07,446.0,COMPLETE
6,0.5744452128756719,2026-09-26 10:00:14.230921,2026-09-26 10:00:26.058784,0 days 00:00:11.827863,64,5,,0.7756625889761463,sgd,4.254500280767681e-05,4.0,COMPLETE
7,0.6496693723534622,2026-09-26 10:00:14.271926,2026-09-26 10:08:59.502851,0 days 00:08:45.230925,64,2,0.002066463288698666,,adam,0.0011895425372303978,97.0,COMPLETE
8,0.6177780608840195,2026-09-26 10:00:14.331402,2026-09-26 10:06:31.151722,0 days 00:06:16.820320,32,1,0.0405119940896805,,adam,0.00021485172403017103,11.0,COMPLETE
9,0.7689458741309649,2026-09-26 10:00:19.258450,2026-09-26 10:09:58.420895,0 days 00:09:39.162445,32,2,0.08916656398688455,,adam,0.0494155735782982,298.0,COMPLETE
10,0.7797194821582402,2026-09-26 10:00:26.060116,2026-09-26 10:08:05.047098,0 days 00:07:38.986982,16,2,,0.21476870693209232,sgd,0.0020503283624386296,978.0,COMPLETE
11,0.7268044989626179,2026-09-26 10:05:34.740716,2026-09-26 10:17:39.087652,0 days 00:12:04.346936,16,5,,0.15197027947763847,sgd,2.464444410098696e-07,,PRUNED
12,0.7505927031388393,2026-09-26 10:06:04.802545,2026-09-26 10:12:24.212049,0 days 00:06:19.409504,64,2,,1.0485147899840868,sgd,0.06450144652189366,13.0,COMPLETE
13,0.7559603974811634,2026-09-26 10:06:31.153352,2026-09-26 10:40:21.939719,0 days 00:33:50.786367,16,10,0.013712723599669366,,adam,0.07892657903676713,,PRUNED
14,0.6080127155146264,2026-09-26 10:07:19.925468,2026-09-26 10:09:14.877576,0 days 00:01:54.952108,16,1,,0.023135332962078183,sgd,3.934727903989159e-06,,PRUNED
15,0.7466081850058846,2026-09-26 10:08:05.050348,2026-09-26 10:19:06.106338,0 days 00:11:01.055990,64,5,,0.42828555741380375,sgd,3.4173096550190386e-06,826.0,COMPLETE
16,0.6224001747169949,2026-09-26 10:08:59.504705,2026-09-26 10:10:43.288071,0 days 00:01:43.783366,16,2,,0.014181478537596536,sgd,0.050208471750119374,,PRUNED
17,0.7606098108445868,2026-09-26 10:09:14.880367,2026-09-26 10:23:19.068145,0 days 00:14:04.187778,64,5,,0.056719771048164364,sgd,0.001581472646849113,968.0,COMPLETE
18,0.7483420085174535,2026-09-26 10:09:58.422352,2026-09-26 10:17:03.616419,0 days 00:07:05.194067,32,2,,0.08924486241615842,sgd,3.413801994176445e-05,968.0,COMPLETE
19,0.7730147174801927,2026-09-26 10:10:00.197217,2026-09-26 10:20:39.583834,0 days 00:10:39.386617,32,2,0.08092897716643623,,adam,0.03418240368787849,56.0,COMPLETE
20,0.7444727550686128,2026-09-26 10:10:43.291099,2026-09-26 10:17:22.852235,0 days 00:06:39.561136,16,2,,0.269112648536911,sgd,0.000376734366303345,,PRUNED
21,0.7522767808393696,2026-09-26 10:12:24.217254,2026-09-26 10:25:27.306489,0 days 00:13:03.089235,16,2,0.07997393832553756,,adam,0.0005928673638348138,562.0,COMPLETE
22,0.6277787888714981,2026-09-26 10:13:23.550992,2026-09-26 10:14:29.050997,0 days 00:01:05.500005,32,1,,0.047025431662219376,sgd,0.04959172160979626,,PRUNED
23,0.6238482631432073,2026-09-26 10:14:29.052722,2026-09-26 10:23:19.397390,0 days 00:08:50.344668,32,10,0.011978023161546406,,adam,6.782110858481534e-07,,PRUNED
24,0.7712984869993569,2026-09-26 10:17:03.619491,2026-09-26 10:42:02.467311,0 days 00:24:58.847820,32,10,0.018799521348501613,,adam,0.045770543134712606,998.0,COMPLETE
25,0.7762767080406217,2026-09-26 10:17:22.853741,2026-09-26 10:25:41.884918,0 days 00:08:19.031177,32,2,,0.3407234555878588,sgd,0.00675748676268759,982.0,COMPLETE
26,0.7458959705893059,2026-09-26 10:17:39.089695,2026-09-26 10:23:47.462341,0 days 00:06:08.372646,64,1,0.08384539288425279,,adam,0.02819766361752794,,PRUNED
27,0.6360723862216235,2026-09-26 10:19:06.109602,2026-09-26 10:25:09.181374,0 days 00:06:03.071772,16,5,0.0023570175325685547,,adam,6.396452381261856e-05,,PRUNED
28,0.6726531503658137,2026-09-26 10:20:39.585436,2026-09-26 10:27:11.257559,0 days 00:06:31.672123,16,10,,0.011756656193733655,sgd,0.0002538884684977018,,PRUNED
29,0.7559573642000025,2026-09-26 10:23:19.069374,2026-09-26 10:34:18.301343,0 days 00:10:59.231969,32,2,0.09696581288443189,,adam,0.004618882391694566,402.0,COMPLETE
30,0.7652834904572975,2026-09-26 10:23:19.399150,2026-09-26 10:34:13.339397,0 days 00:10:53.940247,32,2,0.09953573613281108,,adam,0.08042720716870581,178.0,COMPLETE
31,0.6737511981460585,2026-09-26 10:23:47.463951,2026-09-26 10:27:41.788383,0 days 00:03:54.324432,32,5,0.021329813386574196,,adam,0.015164470436735595,,PRUNED
32,0.777974738834492,2026-09-26 10:25:09.184448,2026-09-26 10:36:26.060259,0 days 00:11:16.875811,16,2,0.028493032742259422,,adam,0.0450342892687844,862.0,COMPLETE
33,0.6729237190453657,2026-09-26 10:25:27.307924,2026-09-26 10:26:43.926357,0 days 00:01:16.618433,64,2,,0.11455584500892346,sgd,0.0004714247883204613,,PRUNED
34,0.7702435118115969,2026-09-26 10:25:41.886113,2026-09-26 10:33:58.870714,0 days 00:08:16.984601,32,2,,0.3974648322377809,sgd,0.01464973961805779,163.0,COMPLETE
35,0.6255317341875053,2026-09-26 10:26:43.927628,2026-09-26 10:29:09.340431,0 days 00:02:25.412803,32,2,0.0051824605181379785,,adam,9.002025740893726e-05,,PRUNED
36,0.7767432266831676,2026-09-26 10:27:11.260769,2026-09-26 10:38:10.147714,0 days 00:10:58.886945,32,5,,0.36540991517696986,sgd,0.0019729966183650713,518.0,COMPLETE
37,0.7822480253339643,2026-09-26 10:27:41.789653,2026-09-26 10:35:11.213808,0 days 00:07:29.424155,32,2,,0.21708861222739265,sgd,0.0030564236337135248,977.0,COMPLETE
