number,value,datetime_start,datetime_complete,duration,params_batch_size,params_local_epochs,params_lr_adam,params_lr_sgd,params_optimizer,params_weight_decay,user_attrs_best_round,state
0,0.5403553792208108,2026-09-27 09:32:55.409746,2026-09-27 09:35:00.754509,0 days 00:02:05.344763,64,1,0.00010007903854383786,,adam,3.27466657122539e-05,1000.0,COMPLETE
1,0.7763391936325362,2026-09-27 09:32:55.413648,2026-09-27 09:35:05.520810,0 days 00:02:10.107162,16,1,,0.18398814851291084,sgd,0.0005330930205460225,944.0,COMPLETE
2,0.7279049733677916,2026-09-27 09:32:55.415591,2026-09-27 09:38:56.102573,0 days 00:06:00.686982,32,5,0.006431172050131994,,adam,0.0056279499752231385,272.0,COMPLETE
3,0.6749390310486659,2026-09-27 09:32:55.417867,2026-09-27 09:37:46.825370,0 days 00:04:51.407503,64,5,0.0007459577266393833,,adam,1.51097495316778e-07,,PRUNED
4,0.7431071718899769,2026-09-27 09:32:55.437490,2026-09-27 09:40:00.554662,0 days 00:07:05.117172,64,10,,1.730517074045618,sgd,0.004745669949715015,272.0,COMPLETE
5,0.7765588031885852,2026-09-27 09:32:55.460400,2026-09-27 09:37:07.457113,0 days 00:04:11.996713,64,5,,0.7756625889761463,sgd,4.254500280767681e-05,947.0,COMPLETE
6,0.6545444618352565,2026-09-27 09:32:55.462861,2026-09-27 09:35:23.230022,0 days 00:02:27.767161,16,1,0.0004170205589203407,,adam,3.0510379709992126e-07,1000.0,COMPLETE
7,0.6811129715235564,2026-09-27 09:32:55.465901,2026-09-27 09:35:47.449277,0 days 00:02:51.983376,64,2,0.002066463288698666,,adam,0.0011895425372303978,1000.0,COMPLETE
8,0.7148375981266455,2026-09-27 09:32:55.529433,2026-09-27 09:35:08.833155,0 days 00:02:13.303722,32,1,0.0405119940896805,,adam,0.00021485172403017103,272.0,COMPLETE
9,0.747387131608003,2026-09-27 09:35:00.760654,2026-09-27 09:37:33.843426,0 days 00:02:33.082772,64,2,,1.0485147899840868,sgd,0.06450144652189366,389.0,COMPLETE
10,0.7771041871413145,2026-09-27 09:35:05.522205,2026-09-27 09:40:40.038124,0 days 00:05:34.515919,16,5,,0.15197027947763847,sgd,2.464444410098696e-07,941.0,COMPLETE
11,0.7545123090549509,2026-09-27 09:35:08.834812,2026-09-27 09:45:59.101909,0 days 00:10:50.267097,16,10,0.013712723599669366,,adam,0.07892657903676713,,PRUNED
12,0.7209102270107621,2026-09-27 09:35:23.233130,2026-09-27 09:37:40.198640,0 days 00:02:16.965510,16,1,,0.023135332962078183,sgd,3.934727903989159e-06,1000.0,COMPLETE
13,0.7430258799548648,2026-09-27 09:35:47.451005,2026-09-27 09:39:04.833666,0 days 00:03:17.382661,16,2,,0.014181478537596536,sgd,0.050208471750119374,948.0,COMPLETE
14,0.7759570002062631,2026-09-27 09:37:07.458898,2026-09-27 09:40:03.015705,0 days 00:02:55.556807,16,2,,0.21476870693209232,sgd,0.0020503283624386296,948.0,COMPLETE
15,0.7493545177689611,2026-09-27 09:37:33.845700,2026-09-27 09:39:56.415303,0 days 00:02:22.569603,16,1,0.04257625486011382,,adam,0.055890395249883484,169.0,COMPLETE
16,0.765062667588784,2026-09-27 09:37:40.200323,2026-09-27 09:41:34.025586,0 days 00:03:53.825263,64,5,,0.056719771048164364,sgd,0.001581472646849113,1000.0,COMPLETE
17,0.5782186146398282,2026-09-27 09:37:46.826972,2026-09-27 09:38:18.220149,0 days 00:00:31.393177,32,1,0.0006846393360094255,,adam,0.001441542695708797,,PRUNED
18,0.7770659677986871,2026-09-27 09:38:18.221528,2026-09-27 09:40:34.977637,0 days 00:02:16.756109,64,2,,0.5895964077637577,sgd,1.681880092197461e-05,947.0,COMPLETE
19,0.7761584100753468,2026-09-27 09:38:56.104461,2026-09-27 09:40:50.075893,0 days 00:01:53.971432,16,1,,0.32522236287064604,sgd,0.0021354899774039407,944.0,COMPLETE
20,0.7744646258751016,2026-09-27 09:39:04.836367,2026-09-27 09:43:15.863119,0 days 00:04:11.026752,64,5,,0.09635940022284618,sgd,1.458427462072926e-05,978.0,COMPLETE
21,0.7718183913903348,2026-09-27 09:39:56.416515,2026-09-27 09:41:34.251398,0 days 00:01:37.834883,64,1,,0.38399497853647413,sgd,0.0005147595008241604,999.0,COMPLETE
22,0.7173982940826751,2026-09-27 09:40:00.555950,2026-09-27 09:41:16.315115,0 days 00:01:15.759165,16,5,0.09333505682792287,,adam,6.955128471391328e-05,,PRUNED
23,0.7752763319137578,2026-09-27 09:40:03.016921,2026-09-27 09:45:31.560010,0 days 00:05:28.543089,32,5,,1.6733768299196965,sgd,7.951747796432806e-05,971.0,COMPLETE
24,0.7770004489256117,2026-09-27 09:40:34.982893,2026-09-27 09:43:11.365532,0 days 00:02:36.382639,64,2,,0.6131478500399917,sgd,3.831351341197e-07,941.0,COMPLETE
25,0.7771387665465488,2026-09-27 09:40:40.043178,2026-09-27 09:47:16.705624,0 days 00:06:36.662446,16,5,,0.09145739346401471,sgd,2.0324942910104125e-07,950.0,COMPLETE
26,0.7254662153144298,2026-09-27 09:40:50.078872,2026-09-27 09:41:14.754393,0 days 00:00:24.675521,64,2,,0.20153271391361424,sgd,9.384173122611332e-05,,PRUNED
27,0.6744160933765272,2026-09-27 09:41:14.755707,2026-09-27 09:41:36.835113,0 days 00:00:22.079406,32,1,,0.06239986835934339,sgd,1.609972118546264e-07,,PRUNED
28,0.7767226003712736,2026-09-27 09:41:16.316400,2026-09-27 09:50:38.023295,0 days 00:09:21.706895,16,10,,0.3561351866147212,sgd,2.3631890411081172e-05,967.0,COMPLETE
29,0.7017762894478214,2026-09-27 09:41:34.027170,2026-09-27 09:43:51.961048,0 days 00:02:17.933878,64,10,0.004240407739881002,,adam,1.6638026625166267e-05,,PRUNED
30,0.776703187371844,2026-09-27 09:41:34.252750,2026-09-27 09:48:03.799776,0 days 00:06:29.547026,16,5,,0.7928002891222036,sgd,7.077464599930995e-06,965.0,COMPLETE
31,0.7771351266091556,2026-09-27 09:41:36.836822,2026-09-27 09:45:40.943567,0 days 00:04:04.106745,16,2,,0.5017127465999074,sgd,4.400760994325259e-07,948.0,COMPLETE
32,0.7769009573035344,2026-09-27 09:43:11.367030,2026-09-27 09:46:33.232658,0 days 00:03:21.865628,64,2,,0.4509174733148396,sgd,4.06612335151865e-07,947.0,COMPLETE
33,0.7765151239398682,2026-09-27 09:43:15.867656,2026-09-27 09:50:16.503949,0 days 00:07:00.636293,64,10,,0.5873760463804789,sgd,2.8248040078107e-07,975.0,COMPLETE
34,0.7317153811621108,2026-09-27 09:43:51.968672,2026-09-27 09:44:39.879127,0 days 00:00:47.910455,32,2,,0.150725255711803,sgd,8.680931716227809e-07,,PRUNED
35,0.7768160254310292,2026-09-27 09:44:39.882956,2026-09-27 09:49:17.283759,0 days 00:04:37.400803,32,5,,0.6067520950162221,sgd,3.032182572500431e-07,950.0,COMPLETE
36,0.5127416008444654,2026-09-27 09:45:31.562152,2026-09-27 09:46:16.218999,0 days 00:00:44.656847,64,2,0.00010784936902579174,,adam,1.2255432136176883e-07,,PRUNED
37,0.7770599012363655,2026-09-27 09:45:40.944948,2026-09-27 09:51:51.539114,0 days 00:06:10.594166,16,10,,0.18154065002304326,sgd,3.1285896955985445e-07,949.0,COMPLETE
