number,value,datetime_start,datetime_complete,duration,params_batch_size,params_local_epochs,params_lr_adam,params_lr_sgd,params_optimizer,params_weight_decay,user_attrs_best_round,state
0,0.7067799900508378,2026-09-26 11:30:00.580427,2026-09-26 11:56:08.640522,0 days 00:26:08.060095,32,5,0.006431172050131994,,adam,0.0056279499752231385,,PRUNED
1,0.7544801562746454,2026-09-26 11:30:00.581518,2026-09-26 11:40:04.229624,0 days 00:10:03.648106,16,1,,0.18398814851291084,sgd,0.0005330930205460225,981.0,COMPLETE
2,0.6735437217146532,2026-09-26 11:30:00.589747,2026-09-26 11:54:33.937351,0 days 00:24:33.347604,64,5,0.0007459577266393833,,adam,1.51097495316778e-07,,PRUNED
3,0.5963248765454567,2026-09-26 11:30:00.581413,2026-09-26 11:39:53.204989,0 days 00:09:52.623576,64,1,0.00010007903854383786,,adam,3.27466657122539e-05,1000.0,COMPLETE
4,0.5,2026-09-26 11:30:00.642625,2026-09-26 11:30:05.704672,0 days 00:00:05.062047,64,10,,1.730517074045618,sgd,0.004745669949715015,,COMPLETE
5,0.6296764095657555,2026-09-26 11:30:00.658039,2026-09-26 11:42:23.956221,0 days 00:12:23.298182,16,1,0.0004170205589203407,,adam,3.0510379709992126e-07,998.0,COMPLETE
6,0.6259588201749597,2026-09-26 11:30:00.714672,2026-09-26 11:30:33.474593,0 days 00:00:32.759921,64,5,,0.7756625889761463,sgd,4.254500280767681e-05,18.0,COMPLETE
7,0.66125650638809,2026-09-26 11:30:00.773242,2026-09-26 11:44:50.997416,0 days 00:14:50.224174,64,2,0.002066463288698666,,adam,0.0011895425372303978,893.0,COMPLETE
8,0.647072883679734,2026-09-26 11:30:00.832605,2026-09-26 11:40:47.587047,0 days 00:10:46.754442,32,1,0.0405119940896805,,adam,0.00021485172403017103,124.0,COMPLETE
9,0.6014153289896748,2026-09-26 11:30:05.706670,2026-09-26 11:45:59.809581,0 days 00:15:54.102911,32,2,0.08916656398688455,,adam,0.0494155735782982,,PRUNED
10,0.771785631953797,2026-09-26 11:30:33.478651,2026-09-26 11:45:40.171357,0 days 00:15:06.692706,16,2,,0.21476870693209232,sgd,0.0020503283624386296,982.0,COMPLETE
11,0.7529550225069461,2026-09-26 11:39:53.208272,2026-09-26 11:48:54.753982,0 days 00:09:01.545710,64,2,,1.0485147899840868,sgd,0.06450144652189366,20.0,COMPLETE
12,0.7154236280469308,2026-09-26 11:40:04.231075,2026-09-26 11:55:26.703752,0 days 00:15:22.472677,16,5,,0.15197027947763847,sgd,2.464444410098696e-07,,PRUNED
13,0.7765739695943896,2026-09-26 11:40:47.589104,2026-09-26 12:23:55.554435,0 days 00:43:07.965331,16,10,0.013712723599669366,,adam,0.07892657903676713,886.0,COMPLETE
14,0.6200384620051202,2026-09-26 11:42:23.962768,2026-09-26 11:45:53.156390,0 days 00:03:29.193622,16,1,,0.023135332962078183,sgd,3.934727903989159e-06,,PRUNED
15,0.6208726143243669,2026-09-26 11:44:50.999370,2026-09-26 11:46:59.919385,0 days 00:02:08.920015,16,2,,0.014181478537596536,sgd,0.050208471750119374,,PRUNED
16,0.722269136970844,2026-09-26 11:45:40.172620,2026-09-26 11:55:18.344468,0 days 00:09:38.171848,64,5,,0.42828555741380375,sgd,3.4173096550190386e-06,,PRUNED
17,0.7589148133318775,2026-09-26 11:45:53.158886,2026-09-26 12:04:02.022168,0 days 00:18:08.863282,64,5,,0.056719771048164364,sgd,0.001581472646849113,968.0,COMPLETE
18,0.7469309261214041,2026-09-26 11:45:59.811125,2026-09-26 11:55:12.619601,0 days 00:09:12.808476,32,2,,0.08924486241615842,sgd,3.413801994176445e-05,983.0,COMPLETE
19,0.7621670973925916,2026-09-26 11:46:59.920506,2026-09-26 11:53:41.396289,0 days 00:06:41.475783,16,1,,0.22403075460705513,sgd,0.0009264365988686994,982.0,COMPLETE
20,0.7207537097028598,2026-09-26 11:48:54.755269,2026-09-26 11:55:46.936053,0 days 00:06:52.180784,16,2,,0.21220968509193122,sgd,1.8831637278586903e-05,,PRUNED
21,0.7439322243657409,2026-09-26 11:53:41.399041,2026-09-26 11:59:32.512621,0 days 00:05:51.113580,32,1,,0.3129351364130569,sgd,0.038362871148571676,,PRUNED
22,0.6818148727841882,2026-09-26 11:54:33.938988,2026-09-26 11:58:28.483406,0 days 00:03:54.544418,16,2,0.003116129826877015,,adam,0.0005904728448421364,,PRUNED
23,0.691586891372135,2026-09-26 11:55:12.627750,2026-09-26 12:10:26.512856,0 days 00:15:13.885106,16,10,,0.057138037785835885,sgd,3.263197805528207e-05,,PRUNED
24,0.7774287482255304,2026-09-26 11:55:18.346798,2026-09-26 12:17:18.449454,0 days 00:22:00.102656,16,5,,0.3927241063738989,sgd,0.0018264658607091973,724.0,COMPLETE
25,0.7839151166599935,2026-09-26 11:55:26.706627,2026-09-26 12:02:50.835294,0 days 00:07:24.128667,16,1,,0.10855511517767427,sgd,0.01801124997795539,944.0,COMPLETE
26,0.7656189713536927,2026-09-26 11:55:46.937916,2026-09-26 12:08:17.234847,0 days 00:12:30.296931,16,2,,0.3945147229092743,sgd,0.0011706735039928025,982.0,COMPLETE
27,0.5770708210485447,2026-09-26 11:56:08.643727,2026-09-26 11:58:49.557546,0 days 00:02:40.913819,32,2,0.00010916976312837418,,adam,1.350573447525301e-07,,PRUNED
28,0.6952043824846214,2026-09-26 11:58:28.484643,2026-09-26 12:10:50.176291,0 days 00:12:21.691648,32,10,,0.11980878072829405,sgd,0.0002338374014420563,,PRUNED
29,0.7285079896625779,2026-09-26 11:58:49.558768,2026-09-26 12:03:14.485725,0 days 00:04:24.926957,16,1,,0.253418107356186,sgd,0.0001719186449390971,,PRUNED
30,0.6386537084895473,2026-09-26 11:59:32.513976,2026-09-26 12:01:26.518445,0 days 00:01:54.004469,16,1,0.015098221569701375,,adam,0.004496378727895886,,PRUNED
31,0.6852364139336804,2026-09-26 12:01:26.520295,2026-09-26 12:13:28.802886,0 days 00:12:02.282591,16,10,,0.19484207408232798,sgd,0.0017676682651122232,,PRUNED
32,0.6705607930210268,2026-09-26 12:02:50.836484,2026-09-26 12:04:23.958504,0 days 00:01:33.122020,16,1,,0.05855029979245038,sgd,0.03229917236949932,,PRUNED
33,0.6172715029301497,2026-09-26 12:03:14.487234,2026-09-26 12:04:28.690337,0 days 00:01:14.203103,64,1,,0.10128952704617654,sgd,0.003012284712153501,,PRUNED
34,0.7821909996481393,2026-09-26 12:04:02.024074,2026-09-26 12:13:30.661084,0 days 00:09:28.637010,32,2,,0.10894790989473091,sgd,0.005811664630941348,984.0,COMPLETE
35,0.7854754364891591,2026-09-26 12:04:23.959847,2026-09-26 12:11:49.415030,0 days 00:07:25.455183,16,1,,0.3608639932902437,sgd,0.0030945924008762664,979.0,COMPLETE
36,0.7030539074727915,2026-09-26 12:04:28.691639,2026-09-26 12:14:54.662451,0 days 00:10:25.970812,32,10,,0.04223914623261967,sgd,1.0209964647693978e-07,,PRUNED
37,0.6961246799888374,2026-09-26 12:08:17.239280,2026-09-26 12:11:49.659750,0 days 00:03:32.420470,16,2,,0.7026369421917695,sgd,0.0007306458977341977,,PRUNED
