number,value,datetime_start,datetime_complete,duration,params_colsample_bytree,params_gamma,params_id_encoding,params_learning_rate,params_max_depth,params_min_child_weight,params_reg_alpha,params_reg_lambda,params_subsample,user_attrs_best_iteration,state
0,0.8058499860469066,2026-09-26 09:56:10.690351,2026-09-26 09:56:14.224312,0 days 00:00:03.533961,0.9458865003910399,3.958625190413323,categorical,0.042246380742484616,6,12.512806369135342,0.03417952912061012,7.155682161754871,0.7187936056313462,224,COMPLETE
1,0.8076687414309809,2026-09-26 09:56:11.299036,2026-09-26 09:56:18.674371,0 days 00:00:07.375335,0.6727803635215239,2.095972572016474,categorical,0.016473134545751462,4,1.4350945090735,0.14297724879798399,0.03864291653552653,0.5931301056888354,526,COMPLETE
2,0.7996529926351933,2026-09-26 09:56:11.468007,2026-09-26 09:56:13.814558,0 days 00:00:02.346551,0.8096354831753318,3.1056691638464744,none,0.04177670806041921,5,3.6410693619577073,0.011676403660687685,0.01579860331902886,0.6023243170189212,344,COMPLETE
3,0.7953839527293465,2026-09-26 09:56:11.561219,2026-09-26 09:56:12.834606,0 days 00:00:01.273387,0.5031151276022949,3.8969146089687623,none,0.10730749996210634,8,2.3287859445525956,0.05484867361012626,0.010278493120340694,0.9881372273881208,227,COMPLETE
4,0.8045208022422015,2026-09-26 09:56:11.601074,2026-09-26 09:56:15.696901,0 days 00:00:04.095827,0.7592089939364717,0.4037063438243743,categorical,0.0526553553521525,10,10.947992050946914,0.005634883151169029,0.01538870258903582,0.8829539282401577,46,COMPLETE
5,0.8086169451218772,2026-09-26 09:56:11.602990,2026-09-26 09:56:28.851701,0 days 00:00:17.248711,0.7094037142783272,2.1907071305443706,numeric,0.01442188307289947,2,10.255943227289718,0.3090848574250758,0.02195995253567473,0.7649086810964107,4083,COMPLETE
6,0.8018035889782695,2026-09-26 09:56:11.615011,2026-09-26 09:56:13.617112,0 days 00:00:02.002101,0.6036214390690934,0.14938105439283478,categorical,0.20844473290143367,6,33.32537715612523,0.0579748154193944,0.0016064559195630038,0.5627926552319181,45,COMPLETE
7,0.8068273092369478,2026-09-26 09:56:11.697745,2026-09-26 09:56:12.783085,0 days 00:00:01.085340,0.5360255666798808,3.3961499806047026,categorical,0.2783614531858727,8,8.22031256573439,0.09989183779852141,0.011851025167261414,0.7505602318299689,39,COMPLETE
8,0.8102973828850144,2026-09-26 09:56:11.794684,2026-09-26 09:56:17.397844,0 days 00:00:05.603160,0.7011756800186824,2.776782369111652,categorical,0.0220682532833669,6,1.0456015696975167,0.08195343912941568,0.12322495987505251,0.7152344091462453,205,COMPLETE
9,0.8078361785510624,2026-09-26 09:56:12.784740,2026-09-26 09:56:15.195126,0 days 00:00:02.410386,0.9656030098445109,4.750647502068228,numeric,0.22058700947603796,4,2.304280343334354,0.2524617974058923,0.001257757484073345,0.7260619809088416,418,COMPLETE
10,0.7886731214889771,2026-09-26 09:56:12.837342,2026-09-26 09:56:14.766209,0 days 00:00:01.928867,0.5220800289657498,4.744886533907814,none,0.07626664899102081,3,1.0357790209088305,0.05553753341120423,6.708290647610256,0.6932856413218147,291,COMPLETE
11,0.8080151421395552,2026-09-26 09:56:13.619698,2026-09-26 09:56:16.851166,0 days 00:00:03.231468,0.6296262234537326,3.4656895915649817,categorical,0.07460639001001393,8,1.098359469899071,0.013617592283802478,0.045751442133913925,0.7794270439954409,63,COMPLETE
12,0.8122071367039153,2026-09-26 09:56:13.816446,2026-09-26 09:56:16.371547,0 days 00:00:02.555101,0.923280742678734,0.32643252193439054,numeric,0.14455570593664688,3,28.240891783800322,0.10495046339351741,0.002082485125344959,0.7471184186909638,357,COMPLETE
13,0.7867997670440069,2026-09-26 09:56:14.226390,2026-09-26 09:56:18.548658,0 days 00:00:04.322268,0.8890783754749252,3.9957928210836178,none,0.013449326615130807,2,1.0823069587789707,8.212461922256873,3.0202896401586674,0.916309922773969,1168,COMPLETE
14,0.8048089639524867,2026-09-26 09:56:14.767950,2026-09-26 09:56:16.750007,0 days 00:00:01.982057,0.7042219300760073,2.60848061222479,categorical,0.07715602450742827,2,1.9292108764082845,5.627122061351095,0.12931094742431812,0.8666900837552849,295,COMPLETE
15,0.7980781130564554,2026-09-26 09:56:15.196711,2026-09-26 09:56:18.283458,0 days 00:00:03.086747,0.7338764298724904,1.861923446925295,none,0.05931217470389052,3,18.833187993726707,0.09184669987254268,0.006597757684493763,0.8345066204419569,741,COMPLETE
16,0.8111539814848518,2026-09-26 09:56:15.698838,2026-09-26 09:56:19.584700,0 days 00:00:03.885862,0.8143939544397416,1.329095587677536,numeric,0.02540147516933789,9,5.055601943920058,0.251024890612582,0.20861774214699924,0.6480399663668239,221,COMPLETE
17,0.8120178599594753,2026-09-26 09:56:16.373282,2026-09-26 09:56:22.021587,0 days 00:00:05.648305,0.6749131425016497,3.202033626074574,numeric,0.021569850245884092,7,1.519488822564464,0.006411695737901102,0.07432757063919566,0.6101531035352799,899,COMPLETE
18,0.8111145488297602,2026-09-26 09:56:16.752326,2026-09-26 09:56:20.144532,0 days 00:00:03.392206,0.6266741141768679,2.79815985954327,categorical,0.0520120007275108,10,1.5789704461120282,0.0013055495919040627,0.004833137222786431,0.9007908200745788,25,COMPLETE
19,0.8104199274439147,2026-09-26 09:56:16.852996,2026-09-26 09:56:20.008262,0 days 00:00:03.155266,0.9006907070741438,1.4418541902788404,numeric,0.10032396260810628,5,38.905254555813585,0.11436900576605362,0.0017580251232833257,0.6241880196340049,347,COMPLETE
20,0.8083002705686795,2026-09-26 09:56:17.399710,2026-09-26 09:56:19.492074,0 days 00:00:02.092364,0.9729685154226919,1.2709215876718898,numeric,0.19376090101143642,2,15.298129788380285,1.177200206130665,0.005057094338281724,0.8090085588134714,326,COMPLETE
21,0.8123588007619603,2026-09-26 09:56:18.285507,2026-09-26 09:56:22.926863,0 days 00:00:04.641356,0.8723341383073997,1.0264289745032609,numeric,0.08982535621664632,2,8.419557222156842,0.0024144498206719973,0.004059219181431494,0.6663887388903327,883,COMPLETE
22,0.8085004671252988,2026-09-26 09:56:18.550477,2026-09-26 09:56:25.614484,0 days 00:00:07.064007,0.9066750311341022,0.30398294030169043,numeric,0.06641332619301712,2,34.55009332283754,0.01262304885751793,0.001097529586863329,0.9299642716416869,1621,COMPLETE
23,0.8087649692425289,2026-09-26 09:56:18.675966,2026-09-26 09:56:20.140681,0 days 00:00:01.464715,0.9969470330108894,0.09675452467997156,numeric,0.2568917092628737,5,11.23742219872161,0.025613609063389307,0.10023406927961895,0.8463008376873743,65,COMPLETE
24,0.8069541003894733,2026-09-26 09:56:19.493511,2026-09-26 09:56:26.021141,0 days 00:00:06.527630,0.9191919621149136,0.6003181147423304,categorical,0.017955278730062196,3,1.737584098178625,2.2775122319496646,0.7658382497278697,0.7754749584393362,677,COMPLETE
25,0.8129242043703515,2026-09-26 09:56:19.586761,2026-09-26 09:56:23.152167,0 days 00:00:03.565406,0.9492831184068067,0.15683407147358674,numeric,0.04025437581648903,7,5.6492906685117505,0.3051645683022559,0.6951831574649394,0.7512589859066127,233,COMPLETE
26,0.8131341074266856,2026-09-26 09:56:20.010230,2026-09-26 09:56:30.932143,0 days 00:00:10.921913,0.8901105980247215,1.5695932959396033,numeric,0.011299529036484695,10,3.2346777092627432,0.8383616783312083,1.647870807317813,0.5335276151241455,857,COMPLETE
27,0.8124243196350356,2026-09-26 09:56:20.142235,2026-09-26 09:56:25.074163,0 days 00:00:04.931928,0.9398556921956026,1.4634063101037178,numeric,0.01864187828107073,9,11.753658353847815,0.0157146525029624,0.02092828449840051,0.6696620939901708,342,COMPLETE
28,0.8107208289350757,2026-09-26 09:56:20.145774,2026-09-26 09:56:22.798652,0 days 00:00:02.652878,0.7828421166034553,2.832889878490615,numeric,0.026788118888326603,9,3.507438208544625,0.46438375563054707,0.8245083943896802,0.7675817290556163,205,COMPLETE
29,0.8085690192795352,2026-09-26 09:56:22.023548,2026-09-26 09:56:27.879268,0 days 00:00:05.855720,0.6811343382057445,4.929822136661459,numeric,0.015737169616393057,5,1.0843722773582853,0.009326654063186985,0.018544258556942566,0.6130397123565948,1128,COMPLETE
30,0.8124449459469298,2026-09-26 09:56:22.800730,2026-09-26 09:56:26.115842,0 days 00:00:03.315112,0.723802328469861,2.1360960982809303,numeric,0.031859745273328355,8,1.026386258276982,0.021716794838015255,0.01137159028121925,0.6045838574045455,330,COMPLETE
31,0.7999484342202647,2026-09-26 09:56:22.928408,2026-09-26 09:56:25.660408,0 days 00:00:02.732000,0.8665090287772265,1.3038195518860807,none,0.13007708417034483,2,6.225398769683171,0.0011839881466411866,0.004527703065059541,0.7225294554610256,601,COMPLETE
32,0.8039996845387591,2026-09-26 09:56:23.153805,2026-09-26 09:56:28.314388,0 days 00:00:05.160583,0.8574333792394161,0.03917117390535643,none,0.017826426894788895,7,12.041517688269943,0.13743431523594532,0.1763842093034112,0.8252889187149478,633,COMPLETE
33,0.8114160569771534,2026-09-26 09:56:25.075529,2026-09-26 09:56:31.155849,0 days 00:00:06.080320,0.8462247751412002,2.2491333635460653,numeric,0.014077942213909954,10,13.717617931528153,0.002646904379682743,0.00106525954652992,0.6234137002536219,572,COMPLETE
34,0.8113323384171126,2026-09-26 09:56:25.616117,2026-09-26 09:56:30.570050,0 days 00:00:04.953933,0.9694928970338571,0.9018790846656286,numeric,0.022076899882129953,10,31.96485849641878,0.017602205233723595,0.24534446400830678,0.7836500515686389,387,COMPLETE
35,0.8083257501304311,2026-09-26 09:56:25.661724,2026-09-26 09:56:30.642562,0 days 00:00:04.980838,0.8838750121994554,0.5131263397337635,numeric,0.0491077841402554,2,12.73103019749872,0.0016684657027552915,0.023696041637023345,0.5396114938663386,922,COMPLETE
36,0.8126754753151579,2026-09-26 09:56:26.022561,2026-09-26 09:56:28.348554,0 days 00:00:02.325993,0.9788756308276693,1.1452776835205383,numeric,0.06495346370341301,8,5.182377314059335,0.22023145631476698,3.513381917196881,0.7754827285968409,121,COMPLETE
37,0.8130194493988037,2026-09-26 09:56:26.117544,2026-09-26 09:56:28.104265,0 days 00:00:01.986721,0.7097268525800798,0.8856940874860215,numeric,0.055137542545089964,8,1.0313866511847078,0.027731365729040065,0.0011071481614135677,0.6514683148964616,46,COMPLETE
38,0.8111515548599231,2026-09-26 09:56:27.881065,2026-09-26 09:56:32.492335,0 days 00:00:04.611270,0.9963613174191633,2.446725550640438,numeric,0.016217130374237866,8,4.976061536919471,0.0035816818872560015,0.02837776065073831,0.8273806557814198,433,COMPLETE
39,0.8119292881495772,2026-09-26 09:56:28.106018,2026-09-26 09:56:31.472374,0 days 00:00:03.366356,0.7376214904701791,1.3118809563972906,numeric,0.03201292434817317,8,1.3329981810346048,0.2241830872526358,0.0015910003542251292,0.6400610987390718,217,COMPLETE
40,0.8127943799366651,2026-09-26 09:56:28.316119,2026-09-26 09:56:31.279162,0 days 00:00:02.963043,0.9613873028898885,0.29798920243185445,numeric,0.05134736442265738,7,3.8178021386250207,0.06756447999322021,4.731494257066011,0.6565479872693767,157,COMPLETE
41,0.8119511277739355,2026-09-26 09:56:28.349948,2026-09-26 09:56:30.783461,0 days 00:00:02.433513,0.8626550121202746,0.2593184374724844,numeric,0.12211044016027588,7,6.573161909465627,0.30900862072743807,8.795766166786926,0.8576654337066164,121,COMPLETE
42,0.8096239944672952,2026-09-26 09:56:28.855540,2026-09-26 09:56:30.637811,0 days 00:00:01.782271,0.6822034628521927,1.4491235017073496,numeric,0.09540240087370605,8,1.0456704511846002,0.004643413104291256,0.0010922188081970534,0.6866387666971306,83,COMPLETE
43,0.8045456751477208,2026-09-26 09:56:30.571787,2026-09-26 09:56:33.356079,0 days 00:00:02.784292,0.9354632793992822,1.9410943418018127,none,0.0535932619512613,8,7.308862643392788,0.14186685132709803,2.173738455311242,0.7403539120512872,499,COMPLETE
44,0.8081880391657263,2026-09-26 09:56:30.639830,2026-09-26 09:56:34.242675,0 days 00:00:03.602845,0.982146821924851,1.7944941274980306,categorical,0.0782504414800516,9,2.5374676872481787,0.20133972716810797,4.24405004998373,0.8268855855912751,33,COMPLETE
45,0.7954343051966173,2026-09-26 09:56:30.644420,2026-09-26 09:56:33.497400,0 days 00:00:02.852980,0.5954139052889357,1.1898787064629182,none,0.019935774862997704,7,1.1128617393679592,0.004340536654887745,0.0043334598507197945,0.5687877214649691,303,COMPLETE
46,0.8134568485422051,2026-09-26 09:56:30.785047,2026-09-26 09:56:34.150971,0 days 00:00:03.365924,0.9812981838302042,0.8291388016758724,numeric,0.05087913422244671,7,5.284126652716909,1.5525913172163635,0.024125267858169763,0.8379445262894771,261,COMPLETE
47,0.8115373882235892,2026-09-26 09:56:30.934710,2026-09-26 09:56:34.327243,0 days 00:00:03.392533,0.9456913862906295,0.5147823720148886,numeric,0.0515439636526836,8,6.365909123128698,7.554135970842811,1.0767491376666676,0.7339184639974198,228,COMPLETE
48,0.8080466882636286,2026-09-26 09:56:31.157852,2026-09-26 09:56:37.873808,0 days 00:00:06.715956,0.9215288864581136,1.4698264681955402,categorical,0.014768005032025426,9,3.5222057716531445,0.9608323505389212,1.2513836406618162,0.5475013479643215,176,COMPLETE
49,0.8138244822189058,2026-09-26 09:56:31.281066,2026-09-26 09:56:34.329428,0 days 00:00:03.048362,0.913865578114946,0.38619650676978035,numeric,0.060503898764078794,6,4.742619519913254,0.08364494107003972,5.588621603687244,0.53655678248061,234,COMPLETE
50,0.8132275324864411,2026-09-26 09:56:31.474031,2026-09-26 09:56:40.711081,0 days 00:00:09.237050,0.7865253607551859,0.6531139796185211,numeric,0.010361659527917864,10,2.1973828153986443,2.2748580613679317,2.798889409115034,0.6220028581846654,677,COMPLETE
51,0.8124813453208605,2026-09-26 09:56:32.494007,2026-09-26 09:56:41.459647,0 days 00:00:08.965640,0.9340745933961955,2.510442078743676,numeric,0.01113106221332452,9,1.9591061573130428,1.4497012249060877,1.159583918695332,0.5143424288189895,1162,COMPLETE
52,0.8089627391742196,2026-09-26 09:56:33.358790,2026-09-26 09:56:35.290139,0 days 00:00:01.931349,0.9836608955398314,2.0974550008915873,numeric,0.12229670081111547,9,4.763088063681047,0.15398219033377192,7.082396895283455,0.7377637390647125,234,COMPLETE
53,0.8126342226913696,2026-09-26 09:56:33.498863,2026-09-26 09:56:39.843649,0 days 00:00:06.344786,0.9325422097004323,1.2840692140435277,numeric,0.016050417258226507,7,2.180287504820996,0.0870361004896462,3.4185212437127532,0.7369515401470973,609,COMPLETE
54,0.8128319926230602,2026-09-26 09:56:34.152548,2026-09-26 09:56:38.666913,0 days 00:00:04.514365,0.9837137943433402,2.1502475416560123,numeric,0.04229970412156124,7,6.7815168926892175,0.4833600665912738,0.004112078877287166,0.8813412829647251,922,COMPLETE
55,0.8107851344956867,2026-09-26 09:56:34.244215,2026-09-26 09:56:37.851571,0 days 00:00:03.607356,0.8005723083472006,0.41306292760893076,numeric,0.06122520512049683,4,2.299439357116075,0.04358579738099462,3.1675429248108706,0.5447454292595666,450,COMPLETE
56,0.810133585702326,2026-09-26 09:56:34.329666,2026-09-26 09:56:36.687996,0 days 00:00:02.358330,0.8995350930493157,0.1029198792936038,numeric,0.1036545569162053,7,4.024153217276667,5.233945332017121,0.012563221882906228,0.9770120767916701,153,COMPLETE
57,0.8102464237615112,2026-09-26 09:56:34.333138,2026-09-26 09:56:39.183144,0 days 00:00:04.850006,0.9418677660941254,0.06779454142356556,numeric,0.1099793567992375,2,3.9284529015426997,0.9374285090639781,7.327194456236632,0.5334927352104969,918,COMPLETE
58,0.8004210194251324,2026-09-26 09:56:35.291886,2026-09-26 09:56:41.570179,0 days 00:00:06.278293,0.6810731985060956,2.5007813078167658,none,0.011775757336353164,10,6.79251300180511,0.49204204420490544,6.474083110231315,0.5539870891682551,1126,COMPLETE
59,0.8117278782804935,2026-09-26 09:56:36.689401,2026-09-26 09:56:41.054510,0 days 00:00:04.365109,0.990200388485695,0.5193396539474361,numeric,0.03297080374117518,8,5.395053127497282,0.028376968621033068,3.0797896928604964,0.5120085788333724,327,COMPLETE
60,0.8130200560550358,2026-09-26 09:56:37.852946,2026-09-26 09:56:41.811627,0 days 00:00:03.958681,0.9590654697767701,0.520733174145867,numeric,0.027944733287237074,7,6.531799528272754,0.2283821158305617,0.1109939415727675,0.7422491257203224,347,COMPLETE
61,0.8135988061005351,2026-09-26 09:56:37.875485,2026-09-26 09:56:40.128355,0 days 00:00:02.252870,0.9828380265720943,0.02250909740138829,numeric,0.08945444239214959,8,1.2066142109988378,0.1603881689952874,0.38977767773315747,0.589302693781867,77,COMPLETE
62,0.8079411300792293,2026-09-26 09:56:38.669491,2026-09-26 09:56:40.204480,0 days 00:00:01.534989,0.9359579300121266,3.598390956481291,numeric,0.04669502442363328,8,7.727534142761128,1.1725171035702455,0.0031509166716934245,0.8390443087981285,133,COMPLETE
63,0.8110520632378456,2026-09-26 09:56:39.185892,2026-09-26 09:56:42.011953,0 days 00:00:02.826061,0.9822147848809654,1.9462778428339413,numeric,0.024730251693770737,7,7.0309253425108285,1.0191904454247032,0.012084696272692487,0.9024960842571148,305,COMPLETE
64,0.8018988340067218,2026-09-26 09:56:39.850364,2026-09-26 09:56:41.704562,0 days 00:00:01.854198,0.8354149984124485,0.4839504842480002,none,0.13197116751791496,6,11.953606909815939,0.04933022386269432,2.227316396512774,0.5014119618518912,163,COMPLETE
65,0.8014426285201228,2026-09-26 09:56:40.130404,2026-09-26 09:56:43.124859,0 days 00:00:02.994455,0.9645195972141427,1.237725227035567,none,0.031223154698335094,10,2.2960295992853075,0.3046286486702155,0.9374783184125673,0.5552199002948314,207,COMPLETE
66,0.7990863757143377,2026-09-26 09:56:40.209894,2026-09-26 09:56:43.333486,0 days 00:00:03.123592,0.9486669817080837,1.278737119003527,categorical,0.1778931676834742,9,3.1624471947925494,0.17122862595955188,0.7879950319531335,0.5219493273677114,20,COMPLETE
67,0.8128319926230603,2026-09-26 09:56:40.712466,2026-09-26 09:56:49.852125,0 days 00:00:09.139659,0.6764108866321294,0.7981908681583774,numeric,0.010160112076873605,10,2.103425842727687,4.286313122690459,0.8046074629881076,0.8269914891612428,805,COMPLETE
68,0.8126851818148727,2026-09-26 09:56:41.055914,2026-09-26 09:56:45.118782,0 days 00:00:04.062868,0.8584813899488304,0.045620746054760235,numeric,0.041430925477243336,8,1.392423233474243,0.6393621397931594,0.07089872509395373,0.5339651319107817,202,COMPLETE
69,0.8089785122362563,2026-09-26 09:56:41.461144,2026-09-26 09:56:47.681957,0 days 00:00:06.220813,0.7042002539321166,1.3555921769491213,numeric,0.026917302987690024,10,4.349862625895799,9.477393731862493,2.027929172542003,0.5908088380856049,989,COMPLETE
70,0.808203812227763,2026-09-26 09:56:41.571806,2026-09-26 09:56:43.422727,0 days 00:00:01.850921,0.9955716786480167,1.2889937856341707,numeric,0.1483005300118464,7,1.347943320412285,0.2866067018238159,0.10038344439046426,0.6043352128703582,43,COMPLETE
71,0.8117036120312063,2026-09-26 09:56:41.706071,2026-09-26 09:56:48.689177,0 days 00:00:06.983106,0.9150793829712655,0.4919932533106191,numeric,0.01446703405060248,10,7.835310116231616,0.7368002479320196,1.2031438679716704,0.6208879436736898,410,COMPLETE
72,0.8089299797376819,2026-09-26 09:56:41.815721,2026-09-26 09:56:44.249011,0 days 00:00:02.433290,0.8880139397387655,0.35435468113919794,numeric,0.12754403854642188,8,1.2283780304733303,0.1769665574941275,3.153736196956167,0.5007792588155817,62,COMPLETE
73,0.8062691855033427,2026-09-26 09:56:42.013729,2026-09-26 09:56:45.847408,0 days 00:00:03.833679,0.989068038490669,1.1008116115981412,categorical,0.06035233061282031,8,11.47225693623449,0.5393237948264076,0.04714874748804296,0.7591073920797881,89,COMPLETE
74,0.8114075637899028,2026-09-26 09:56:43.126839,2026-09-26 09:56:51.016422,0 days 00:00:07.889583,0.9148086422740849,0.48635109445539815,numeric,0.015917282189436287,10,1.4919460710048367,0.8060921295172551,0.7190848031884479,0.6085607378071158,305,COMPLETE
75,0.8137456169087225,2026-09-26 09:56:43.336581,2026-09-26 09:56:46.309324,0 days 00:00:02.972743,0.7840257908897067,0.37895969385249983,numeric,0.03724935571158628,9,1.6067196670835209,0.010693745486223769,0.0013761482492694664,0.6775565111872126,94,COMPLETE
76,0.8091441293876412,2026-09-26 09:56:43.424245,2026-09-26 09:56:48.256209,0 days 00:00:04.831964,0.9871542159004651,0.12388908121680761,categorical,0.06497045046197923,8,1.2276519036860627,0.012522601321821852,0.268076378493714,0.5902277365378239,31,COMPLETE
77,0.8062752520656644,2026-09-26 09:56:44.265222,2026-09-26 09:56:47.291656,0 days 00:00:03.026434,0.7112488953197073,1.4828667451266104,categorical,0.07604009126880641,7,1.7314784703010326,0.03424647318176947,0.0011563180731174237,0.5858416032318435,45,COMPLETE
78,0.8072076826945243,2026-09-26 09:56:45.120312,2026-09-26 09:56:59.112055,0 days 00:00:13.991743,0.6966660091378282,0.30146514585046474,categorical,0.01071478385979738,9,2.578646178508961,1.1288467938659685,8.876592803393946,0.567905058013509,503,COMPLETE
79,0.7994540093910385,2026-09-26 09:56:45.849152,2026-09-26 09:56:50.559896,0 days 00:00:04.710744,0.9862839298755309,0.6467835561364343,none,0.03988717524435126,6,15.062337842615872,8.034440721707929,0.006722923892645436,0.7464160232389387,801,COMPLETE
80,0.8104017277569493,2026-09-26 09:56:46.310977,2026-09-26 09:56:49.660461,0 days 00:00:03.349484,0.8895920676956055,0.28771891143086525,numeric,0.0365832325576169,10,1.9443852788583298,0.0033252046066841955,0.0021076299968809773,0.5450573312192092,77,COMPLETE
81,0.8118164500903917,2026-09-26 09:56:47.302486,2026-09-26 09:56:50.643573,0 days 00:00:03.341087,0.8139153357327571,0.07818630475567134,numeric,0.039420344181542985,8,1.469902096358123,0.004349455219649084,0.008488908525132944,0.7371820751164122,106,COMPLETE
82,0.8114548829760129,2026-09-26 09:56:47.684040,2026-09-26 09:56:50.797172,0 days 00:00:03.113132,0.8879584371703142,0.3882080743895422,numeric,0.057218722734901695,5,3.5868043457250045,4.221146597477671,0.0016137328426872597,0.7313883001133342,248,COMPLETE
