number,value,datetime_start,datetime_complete,duration,params_colsample_bytree,params_gamma,params_id_encoding,params_learning_rate,params_max_depth,params_min_child_weight,params_reg_alpha,params_reg_lambda,params_subsample,user_attrs_best_iteration,state
83,0.8051978305973138,2026-09-26 09:56:48.257902,2026-09-26 09:56:51.444905,0 days 00:00:03.187003,0.8120761254350879,1.8035936693540568,none,0.029886112553199902,10,1.4759743877915645,0.003603450301014366,0.001276941327881721,0.6992551086674699,203,COMPLETE
84,0.8101900047319186,2026-09-26 09:56:48.691509,2026-09-26 09:56:51.906017,0 days 00:00:03.214508,0.9341676335129023,0.25051960239975113,numeric,0.11170830569933375,10,2.406876388504191,0.021559441978953608,0.3475146858036577,0.646996869571733,28,COMPLETE
85,0.8141241703976025,2026-09-26 09:56:49.662332,2026-09-26 09:57:00.890745,0 days 00:00:11.228413,0.7647860675424185,1.9222507616544742,numeric,0.011638652815149053,9,2.113754022756171,0.23305362631845167,6.4819753576561645,0.6220484571600801,1162,COMPLETE
86,0.8123794270738542,2026-09-26 09:56:49.854679,2026-09-26 09:56:57.833799,0 days 00:00:07.979120,0.9545503036702077,1.7377071015111218,numeric,0.016796382916437244,5,4.206224392202214,0.2677438673904092,0.06800076338491247,0.7185682117646061,889,COMPLETE
87,0.812736747594608,2026-09-26 09:56:50.561641,2026-09-26 09:56:54.310880,0 days 00:00:03.749239,0.9364412757768251,0.2979870989028528,numeric,0.07224426889767327,8,12.226809132505041,0.4173291399455377,0.01698940931619088,0.8220003974243966,141,COMPLETE
88,0.8105606716897802,2026-09-26 09:56:50.645153,2026-09-26 09:56:55.721914,0 days 00:00:05.076761,0.9618408185173017,0.5181310244942832,numeric,0.022282102129145727,5,11.940423463826193,0.03694610789404236,0.038435524949799696,0.8976004807898085,473,COMPLETE
89,0.8113347650420413,2026-09-26 09:56:50.799369,2026-09-26 09:56:54.245409,0 days 00:00:03.446040,0.9741323036868317,0.20316834507333498,numeric,0.08941139576602863,5,5.978702105476432,0.6850357438113915,0.1243497067598835,0.7571161776964639,216,COMPLETE
90,0.8121998568291291,2026-09-26 09:56:51.018727,2026-09-26 09:56:54.134209,0 days 00:00:03.115482,0.9817433152646684,1.7429584444288893,numeric,0.09943482361392703,6,8.572873141509488,0.13354993598170603,6.075337614651563,0.5519341809362951,155,COMPLETE
91,0.8123527341996385,2026-09-26 09:56:51.447546,2026-09-26 09:56:55.823168,0 days 00:00:04.375622,0.9666404831782518,0.6127735486084315,numeric,0.04416720752650566,7,12.958264494952704,0.6049687158296128,0.015511699875320046,0.5435668259665276,272,COMPLETE
92,0.8099673618947087,2026-09-26 09:56:51.910245,2026-09-26 09:56:59.656250,0 days 00:00:07.746005,0.8539321362355496,0.5512992552551381,numeric,0.01763005263297815,4,12.693495352610784,0.034095430802891485,8.316851004196167,0.5085785909991754,1046,COMPLETE
93,0.8072313422875793,2026-09-26 09:56:54.136586,2026-09-26 09:57:02.627079,0 days 00:00:08.490493,0.8150383772223082,0.34541367507577975,categorical,0.039272419952165814,10,1.7732582120116716,0.022741460969969516,0.001445538083729058,0.664475910421908,45,COMPLETE
94,0.8135854596634271,2026-09-26 09:56:54.247457,2026-09-26 09:57:01.848647,0 days 00:00:07.601190,0.7192343113248538,0.7645804164176682,numeric,0.012906860840363483,10,1.648092624366427,1.3549326135737885,3.3294832149881857,0.5425003531771101,442,COMPLETE
95,0.8092600007279874,2026-09-26 09:56:54.312897,2026-09-26 09:56:58.924512,0 days 00:00:04.611615,0.7893252861232678,0.06108793978810495,categorical,0.036168906230006515,5,15.353925757702974,0.011854973067908206,0.8938271431840662,0.7051222291050524,300,COMPLETE
96,0.8158749802836724,2026-09-26 09:56:55.723999,2026-09-26 09:56:58.372802,0 days 00:00:02.648803,0.5833804882071538,1.066047945310664,numeric,0.060321171713341955,6,3.4861760418460723,0.06747072086403312,0.026481938706688603,0.6757699336988072,214,COMPLETE
97,0.8099528021451364,2026-09-26 09:56:55.824832,2026-09-26 09:57:00.148706,0 days 00:00:04.323874,0.9433515388510435,0.3262292112001053,numeric,0.035360059673564134,7,22.123795069355435,0.17591943630948062,0.2574188695282496,0.7258888279678243,382,COMPLETE
98,0.8047076523617127,2026-09-26 09:56:57.836124,2026-09-26 09:56:59.696266,0 days 00:00:01.860142,0.8743724853031092,1.556091800628206,numeric,0.10747191399764011,10,1.2716797759296212,0.10805429417121443,0.0024130236001353284,0.7871084374030954,55,COMPLETE
99,0.8058493793906745,2026-09-26 09:56:58.374744,2026-09-26 09:57:01.674083,0 days 00:00:03.299339,0.5998769432537382,1.7364631036989313,categorical,0.07209894554533446,6,4.306226816462838,0.4019631800130988,0.05830592060205859,0.6444921795692544,216,COMPLETE
100,0.8116490129703103,2026-09-26 09:56:58.926622,2026-09-26 09:57:01.359139,0 days 00:00:02.432517,0.5065819051834619,0.8312117472171128,numeric,0.06967218458559574,7,1.3758061059247244,0.03905168923811284,0.006208423757766062,0.5536840198052704,151,COMPLETE
101,0.8132372389861561,2026-09-26 09:56:59.115614,2026-09-26 09:57:04.169686,0 days 00:00:05.054072,0.6602719375232687,1.1322001015523613,numeric,0.032979545410133454,5,17.440870398984657,0.039047599604857576,0.032005208856392776,0.6988929345357817,603,COMPLETE
102,0.813723777284364,2026-09-26 09:56:59.659435,2026-09-26 09:57:02.723283,0 days 00:00:03.063848,0.5834435633454806,1.174119758113265,numeric,0.03698394022845778,5,1.6903555355842133,0.02955587758994941,0.012295171840412589,0.8273769497614956,243,COMPLETE
103,0.8138620949053009,2026-09-26 09:56:59.698647,2026-09-26 09:57:01.883001,0 days 00:00:02.184354,0.5190545292739508,1.4613769843661586,numeric,0.08571486553686701,6,1.7859924476232505,0.25025207034486185,0.06029637498882402,0.7062825853024232,157,COMPLETE
104,0.8134883946662784,2026-09-26 09:57:00.151079,2026-09-26 09:57:04.237212,0 days 00:00:04.086133,0.7388963938688019,0.5998555432437995,numeric,0.026076562387364915,9,7.298979998752974,0.009171375921538258,0.00123354261019496,0.6983762546496929,200,COMPLETE
105,0.8124643589463594,2026-09-26 09:57:00.894340,2026-09-26 09:57:07.144786,0 days 00:00:06.250446,0.8133312192910401,1.5186699432698838,numeric,0.014284516216262644,9,2.9364640885249895,0.12804254645665866,3.7258755010233715,0.609917330907386,594,COMPLETE
106,0.810197891262937,2026-09-26 09:57:01.360616,2026-09-26 09:57:04.282458,0 days 00:00:02.921842,0.7119607666485441,0.11446273595285811,numeric,0.06263725922934685,9,1.2485280092538864,0.05356841934344767,0.0013211677976408482,0.6646159076843414,75,COMPLETE
107,0.811462162850799,2026-09-26 09:57:01.677443,2026-09-26 09:57:07.812991,0 days 00:00:06.135548,0.7443510895247701,3.5459736186857844,numeric,0.011728064932850406,9,2.4409157942251976,0.0332549026849546,3.6551303028415107,0.5227142124154623,1343,COMPLETE
